实际上，老人政治的代价是将所谓老年人拥有的平等建立在牺牲年轻人的前提上，即所谓权力自享，债留子孙。,实际上，老人政治的代价是将所谓老年人享有的平等建立在牺牲年轻人的前提上，即所谓权力自享，债留子孙。,"In fact, the price of old-time politics is to base the so-called equality of the elderly on the premise of sacrificing the young, that is, the so-called power is self-enjoyed, and the debt is left to the children.","In fact, the price of old-age politics is to base the so-called equality enjoyed by the elderly on the premise of sacrificing the young, that is, the so-called power is self-enjoyed, and the debt is left to the descendants.",0,,
实际上，导致法国反对2003年入侵伊拉克的同样一种法国和联合国关系现在却在促成2011年法国进行利比亚干涉。,实际上，导致法国反对2008年入侵伊拉克的同样一种法国和联合国关系现在却在促成2011年法国进行利比亚干涉。,"Indeed, the same relationship between France and the United Nations that led France to oppose the 2003 invasion of Iraq is now contributing to the French intervention in Libya in 2011.","Indeed, the same relationship that led France to oppose the 2008 invasion of Iraq is now contributing to the 2011 French intervention in Libya.",1,between France and the United Nations,
实际上，富人和企业在互相竞争的同时，也在与其它利益集团展开争夺。,实际上，富人和企业在互相竞争的同时，也在和其它利益集团展开争夺。,"In fact, the rich and corporations compete with each other as well as other interest groups.","In fact, the rich and corporations compete with each other as well as with other interest groups.",0,,
实际上，基地组织通过诗词来规定恐怖运动成员的内涵并且通过赞美所谓烈士的功绩来渲染这一恐怖组织历史上的重大事件。,实际上，基地组织通过诗词来肯定恐怖运动成员的内涵并且通过赞美所谓烈士的功绩来渲染这一恐怖组织历史上的重大事件。,"In fact, Al-Qaida uses poetry to define the membership of a terrorist movement and to portray significant events in the history of this terrorist organization by glorifying the exploits of so-called martyrs.","In fact, Al-Qaida uses poetry to affirm members of terrorist movements and to portray significant events in the history of this terrorist organization by celebrating the exploits of so-called martyrs.",0,,
实际上，和美国相比，从很多方面来说，英国的银行救助和劳动力市场政策都更好一些。,实际上，跟美国相比，从很多方面来说，英国的银行救助和劳动力市场政策都更好一些。,"In fact, in many ways the UK has better bank bailouts and labour market policies than the US.","In fact, the UK has better bank bailouts and labour market policies in many ways than in the US.",0,,
如此看来，这一阶段正是为大选铺路的时候了。,由此看来，这一阶段正是为大选铺路的时候了。,"In this way, it is time to pave the way for general elections.","From this point of view, this phase is the time to pave the way for general elections.",1,,this phase
如果欧洲人不携手合作解决移民问题，无数人还会淹死在地中海，而欧盟也将继续走上瓦解的道路。,如果欧洲人不携手合作解决移民问题，无数人还会淹死在地中海，而欧盟还将继续走上瓦解的道路。,"If Europeans do not work together to solve the migration problem, countless people will drown in the Mediterranean, and the EU will continue on the path of disintegration.","If Europeans do not work together to solve the migration problem, countless people will drown in the Mediterranean, and the EU will continue on the path of disintegration.",0,,
如果政治事实和其他类似组织是正确的，那么政客在撒谎的问题上并不那么相似。,如果政治事实和其他类似组织是正确的，那么政客在说谎的问题上并不那么相似。,"If political facts and other similar organizations are correct, then politicians are not so similar when it comes to lying.","If political facts and other similar organizations are correct, then politicians are not so similar when it comes to lying.",0,,
如今，很难想象有人还会持有1979年撒切尔在英国以及1981年里根在美国上台时的思想。,如今，很难想象有人还会持有1978年撒切尔在英国以及1981年里根在美国上台时的思想。,"Today, it is hard to imagine that anyone would still hold the ideas of Thatcher in Britain in 1979 and Reagan in the United States in 1981.","Today, it is hard to imagine anyone holding the ideas of Thatcher in Britain in 1978 and Reagan in the United States in 1981.",1,would still,
如今，不少国家，特别是欧元区国家，似乎已无多少政策选择。,如今，不少国家，特别是欧元区国家，几乎已无多少政策选择。,"Today, many countries, especially in the eurozone, seem to have few policy options.","Today, many countries, especially in the eurozone, have few policy options.",0,,
她曾担任卢拉的幕僚长，也是2007年出台的旨在加快发展的投资计划的主要制定者。,她曾担任卢拉的幕僚长，也是2005年出台的旨在加快发展的投资计划的主要制定者。,She served as Lula's chief of staff and was the main architect of an investment plan launched in 2007 to accelerate development.,She served as Lula's chief of staff and was the main architect of an investment plan launched in 2005 to accelerate development.,0,,
大萧条过后，更为严格的新规章引入，金融部门的薪金就恢复了正常水准，到1990年前后都一直不见长进。,大萧条过后，较为严格的新规章引入，金融部门的薪金就恢复了正常水准，到1990年前后都一直不见长进。,"After the Great Depression, stricter new regulations were introduced, and salaries in the financial sector returned to normal levels, which did not improve until around 1990.","After the Great Depression, stricter new regulations were introduced, and salaries in the financial sector returned to normal levels, and did not improve until around 1990.",0,,
大多数以色列人也赞同这一观点，甚至连总理本雅明·内塔尼亚胡也不情愿地表达了自己对两国方案的承诺。,大多数以色列人都赞同这一观点，甚至连总理本雅明·内塔尼亚胡也不情愿地表达了自己对两国方案的承诺。,"Most Israelis share this view, and even Prime Minister Benjamin Netanyahu has reluctantly expressed his commitment to the two-state solution.","Most Israelis share this view, and even Prime Minister Benjamin Netanyahu has reluctantly expressed his commitment to the two-state solution.",0,,
坦白说，在经历了15年的通缩性衰退后，日本经济的复苏仍有很长的路要走。,坦白说，在经历了15年的通缩性衰退后，日本经济的复苏还有很长的路要走。,"Frankly, after 15 years of deflationary recession, Japan's economic recovery still has a long way to go.","Frankly, after 15 years of deflationary recession, Japan's economy still has a long way to go.",1,recovery,
在这个问题上，美国，欧盟和俄罗斯都在努力和伊朗接触，但至今都无功而返。,在这个问题上，美国，欧盟和俄罗斯也在努力和伊朗接触，但至今都无功而返。,"On this issue, the United States, the European Union and Russia have all tried to engage with Iran, but so far to no avail.","On this issue, the United States, the European Union and Russia have also tried to engage with Iran, but so far to no avail.",0,,
在这个封闭的支付体系中，随着财政货币接近到期，不拥有该年份财政货币的纳税人将会推高它的需求。,在这个封闭的支付体系中，随着财政货币临近到期，不拥有该年份财政货币的纳税人将会推高它的需求。,"In this closed payment system, taxpayers who do not own fiscal currency for that year will push up its demand as fiscal money approaches maturity.","In this closed payment system, taxpayers who do not own fiscal currency for that year will drive up demand as fiscal money approaches expiration.",0,,
在过去的十年中，大多数的发达国家都出现了史无前例的房市繁荣高潮。,在过去的十年里，大多数的发达国家都出现了史无前例的房市繁荣高潮。,"Over the past decade, most developed countries have seen unprecedented housing booms.","Over the past decade, most developed countries have seen unprecedented housing booms.",0,,
在许多情况下，部分是由于援助国要求使用其自己的国民或者公司，因此经济重建失败。,在很多情况下，部分是由于援助国要求使用其自己的国民或者公司，因此经济重建失败。,"In many cases, economic reconstruction has failed, partly because donors have requested the use of their own nationals or companies.","In many cases, economic reconstruction has failed, partly because donors have requested the use of their own nationals or companies.",0,,
在西班牙，超过25%的劳动力没有工作，意大利的年轻人失业率高达42%。,在西班牙，超过40%的劳动力没有工作，意大利的年轻人失业率高达42%。,"In Spain, more than 25% of the workforce is unemployed, and youth unemployment in Italy is as high as 42%.","In Spain, more than 40% of the workforce is unemployed, and the youth unemployment rate in Italy is as high as 42%.",0,,
在西班牙，该比例上升70%，法国则是60%。,在西班牙，该比例上升40%，法国则是60%。,"In Spain, the share rose by 70 per cent and in France by 60 per cent.","In Spain, the share rose by 40 per cent and in France by 60 per cent.",0,,
在英国，执政的保守党最近也显示出征税和限制未来支出的意愿。,在英国，执政的保守党最近也显示出征税和抑制未来支出的意愿。,"In Britain, the ruling Conservative Party has also recently shown a willingness to tax and limit future spending.","In Britain, the ruling Conservative Party has also recently shown a willingness to tax and curb future spending.",0,,
在研究中，我与政府官员和商界精英进行了40多次深度访谈，并以辅助数据资源来充实我的研究成果。,在研究中，我与政府官员和商界精英进行了30多次深度访谈，并以辅助数据资源来充实我的研究成果。,"In my research, I conducted more than 40 in-depth interviews with government officials and business elites, and enriched my research with supporting data resources.","In my research, I conducted more than 30 in-depth interviews with government officials and business elites, and enriched my research with supporting data resources.",0,,
在最近的访日之旅中，美国国防部长查克·哈格尔已经听到了对美国防务承诺信誉的严重官方质疑。,在最近的访日之旅中，美国国防部长马克·哈格尔已经听到了对美国防务承诺信誉的严重官方质疑。,"During a recent trip to Japan, U.S. Defense Secretary Chuck Hagel has heard serious official questions about the credibility of U.S. defense commitments.","During a recent trip to Japan, Defense Secretary Mark Hagel has heard serious official questions about the credibility of U.S. defense commitments.",1,U.S.,
在更大范围内，随着当局试图在投资者躲避管制之前先发制人，这场猫鼠游戏都不利于稳定和增长。,在更大范围内，随着当局企图在投资者躲避管制之前先发制人，这场猫鼠游戏都不利于稳定和增长。,"More broadly, as authorities try to preempt investors before they dodge regulation, this cat-and-mouse game is not conducive to stability and growth.","More broadly, as authorities try to preempt investors before they dodge regulation, this cat-and-mouse game is not conducive to stability and growth.",0,,
在当选总统努力让美国人民做好准备，迎接未来困难的时候，这些是我们必须面对的主要问题。,在竞选总统努力让美国人民做好准备，迎接未来困难的时候，这些是我们必须面对的主要问题。,These are the main issues we must face as President-elect strives to prepare the American people for a difficult future.,These are the main issues we must face as we run for president and try to prepare the American people for the difficult future.,0,,
在大西洋的两岸，许多人都把经济全球化看作是对收入低于平均水平的人的威胁。,在大西洋的两岸，许多人都把经济全球化看作是对收入高于平均水平的人的威胁。,"On both sides of the Atlantic, many see economic globalization as a threat to people with below-average incomes.","On both sides of the Atlantic, many see economic globalization as a threat to people with above-average incomes.",0,,
在发达国家造成不平等加剧的同一套机制为全球数十亿人创造了公平竞技场。,在发达国家造成不平等加剧的同一套机制为全球几十亿人创造了公平竞技场。,The same mechanisms that have raised inequality in developed countries have leveled the playing field for billions of people around the world.,The same mechanisms that have created a level playing field for billions of people around the world by creating a level playing field for rising inequality in developed countries.,1,by creating a level playing field ,
在不太友好的政权的通知下，过去孟加拉国一直是在印度为非作歹的恐怖和军事组织的避风港。,在不太友好的政权的通知下，过去孟加拉国一直是对印度为非作歹的恐怖和军事组织的避风港。,"In the past, under the behest of the less friendly regime, Bangladesh has been a haven for terrorist and military organizations that commit mischief in India.","In the past, Bangladesh has been a safe haven for terrorist and military organizations that have committed wrongdoing against India, informed by not-so-friendly regimes.",1,under the behest of,informed by
在一个广告无所不在的世界中，对商品和服务的渴望是没有天然的界限的。,在一个广告无所不在的世界中，对商品与服务的渴望是没有天然的界限的。,"In a world where advertising is ubiquitous, there are no natural boundaries to the desire for goods and services.","In a world where advertising is omnipresent, there are no natural boundaries to the desire for goods and services.",0,,
在1750年，亚洲拥有世界五分之三的人口，经济产量占世界的五分之三。,在1750年，亚洲拥有世界四分之三的人口，经济产量占世界的五分之三。,"In 1750, Asia had three-fifths of the world's population and three-fifths of the world's economy.","In 1750, Asia was home to three-quarters of the world's population and three-fifths of the world's economy.",0,,
国际非政府组织和私人基金在抗击疟疾的斗争中与公共部门合作，宣传这项事业并为其提供资金。,国际非政府组织和私人基金在打击疟疾的斗争中与公共部门合作，宣传这项事业并为其提供资金。,International non-governmental organizations and private foundations work with the public sector in the fight against malaria to promote and fund the cause.,International non-governmental organizations and private foundations work with the public sector in the fight against malaria to promote and finance the cause.,0,,
因此，新药比目前市场上同类药品的实际效果更差的风险也是存在的。,因此，新药较目前市场上同类药品的实际效果更差的风险也是存在的。,"Therefore, there is also a risk that the actual effect of new drugs is worse than similar drugs currently on the market.","Therefore, there is also a risk that the actual effect of new drugs is worse than similar drugs currently on the market.",0,,
因此，所有欧元区国家都应该通过发行由所有成员国共同担保的债券来为财政债务融资。,因此，所有欧元区国家都应该通过发行由所有成员国共同担保的债券作为财政债务融资。,"Therefore, all eurozone countries should finance their fiscal debt by issuing bonds jointly guaranteed by all member states.","Therefore, all eurozone countries should finance their fiscal debt by issuing bonds jointly guaranteed by all member states.",0,,
因此，我们需要一个与适应这一现实的全球疾病控制体系。,为此，我们需要一个与适应这一现实的全球疾病控制体系。,"Therefore, we need a global disease control system that adapts to this reality.","To do this, we need a global disease control system that adapts to this reality.",0,,
因此该报告质疑布什坚持放弃与伊朗和叙利亚对话，无意建立更稳定的地区秩序的做法是完全正确的。,因此该报告质疑布什坚持放弃与伊朗及叙利亚对话，无意建立更稳定的地区秩序的做法是完全正确的。,The report is therefore right to question Bush's insistence on abandoning dialogue with Iran and Syria and not having any intention of establishing a more stable regional order.,The report is therefore right to question Bush's insistence on abandoning dialogue with Iran and Syria and not having any intention of establishing a more stable regional order.,0,,
因此设置非战斗性国家服务的选项并不能解决这一争端，除非其中包含对律法的研究。,因此设置非战斗性国家服务的选项也不能解决这一争端，除非其中包含对律法的研究。,"Therefore, the option of setting up non-combatant state services would not resolve the dispute unless it included a study of the law.","Therefore, the option of setting up non-combatant state services cannot resolve the dispute unless it includes a study of the law.",0,,
因为野生鱼类的数量在不断地减少，加上全球对于海产品越来越大的需求，水产业迫切需要大量的鱼饲料。,因为水生鱼类的数量在不断地减少，加上全球对于海产品越来越大的需求，水产业迫切需要大量的鱼饲料。,"Due to the declining number of wild fish and the increasing global demand for seafood, the aquaculture industry urgently needs large quantities of fish feed.","Due to the declining number of aquatic fish and the increasing global demand for seafood, the aquaculture industry urgently needs a large amount of fish feed.",0,,
因为看重政治忠诚度高于能力的继任模式，排外封闭的专制制度阻碍了众多才华横溢的人被提拔到高级领导岗位。,因为看重政治忠诚度高于能力的继任模式，排外封闭的专制制度妨碍了众多才华横溢的人被提拔到高级领导岗位。,"Because of the succession model that values political loyalty over ability, the xenophobic and closed authoritarian system prevents many talented people from being promoted to senior leadership positions.","Because of the succession model that values political loyalty over ability, the xenophobic and closed authoritarian system prevents many talented people from being promoted to senior leadership positions.",0,,
因为生存农业而大肆砍伐、蚕食森林，过度放牧，以及失去生物多样性和土壤给整个大洲带来了巨大的威胁。,因为生存农业而大肆砍伐、蚕食森林，过度放牧，以及失去生物多样性和土壤给整个大洲带来了极大的威胁。,"Widespread deforestation, encroachment on forests, overgrazing, and loss of biodiversity and soils for subsistence agriculture pose enormous threats to entire continents.","Widespread deforestation, encroachment on forests, overgrazing, and loss of biodiversity and soils for subsistence agriculture pose a great threat to entire continents.",0,,
因为来自自然资源相关产品的收入在国家财政收入中并未单独归类，我们只能对这笔开支如何分配进行合理的猜测。,因为来自自然资源相关产品的收入在国家财政收入中并未单独归类，我们只能对该笔开支如何分配进行合理的猜测。,"Because revenues from natural resource-related products are not separately classified in state revenues, we can only make reasonable guesses about how this expenditure will be distributed.","Because revenues from natural resource-related products are not separately classified in state revenues, we can only make reasonable guesses about how this expenditure will be distributed.",0,,
唯一确定的是，未来将由科学进步和创新决定，但科学进步和创新是无法预知的。,唯一确定的是，未来将由科学进步和创新决定，而科学进步和创新是无法预知的。,"The only certainty is that the future will be determined by scientific progress and innovation, but scientific progress and innovation are unpredictable.","The only certainty is that the future will be determined by scientific progress and innovation, which are unpredictable.",0,,
哈马斯在2006年一月选举中胜出在很大程度上是因为法塔赫在阿拉法特的继任者阿巴斯领导下的四分五裂。,哈马斯在2006年一月选举中胜出在很大程度上是因为法塔赫在穆拉法特的继任者阿巴斯领导下的四分五裂。,"Hamas's victory in the January 2006 elections was largely due to Fatah's fragmentation under Arafat's successor, Abbas.","Hamas's victory in the January 2006 elections was largely due to Fatah's fragmentation under Mulawat's successor, Abbas.",0,,
和援助亚洲海啸相似的行动能够改变这种灾难性的状况，每年可以拯救百万以上的生命。,和援助亚洲海啸相似的行动能够改变这种灾难性的状况，每年可以拯救100万以上的生命。,"Actions similar to those in response to the Asian tsunami could change this catastrophic situation, saving more than a million lives each year.","Actions similar to those in response to the Asian tsunami could change this catastrophic situation, saving more than 1 million lives a year.",0,,
后来发现，这一方针无法刺激竞争，因为各国都利用国家规则阻挠新进入者。,后来发现，这一方针无法刺激竞争，因为各国都使用国家规则阻挠新进入者。,"It turned out that this approach did not stimulate competition, as countries used national rules to discourage new entrants.","It turned out that this approach did not stimulate competition, as countries used national rules to discourage new entrants.",0,,
名人小组将放宽这一解释，允许在一些情况下动用防卫性武力，但是要得到安理会的批准。,名人小组将放宽这一解释，允许在一些情况下动用保卫性武力，但是要得到安理会的批准。,"The Panel of Eminent Persons will relax that interpretation to permit the use of defensive force in certain circumstances, subject to the Council's approval.","The Panel of Eminent Persons will relax that interpretation to allow the use of defensive force in some cases, subject to the Council's approval.",0,,
可直到现在反对派还主要作为执政联盟的刺激物，选民们将辩论看作娱乐，而不是有利于政策制定的思想交锋。,可直到现在反对派还主要作为执政联盟的刺激物，选民们将辩论视作娱乐，而不是有利于政策制定的思想交锋。,"Until now, however, the opposition has served primarily as a stimulus for the ruling coalition, with voters viewing debates as entertainment rather than an exchange of ideas conducive to policymaking.","Until now, however, the opposition has served primarily as a stimulus for the ruling coalition, with voters viewing debates as entertainment rather than a clash of ideas conducive to policymaking.",1,exchange,clash
可是，尽管25年来在结构生物学上投入巨大，但我们仍无法从理解分子进步到理解整个系统。,可是，尽管多年来在结构生物学上投入巨大，但我们仍无法从理解分子进步到理解整个系统。,"But despite 25 years of investment in structural biology, we have not been able to move from understanding molecules to understanding entire systems.","However, despite years of investment in structural biology, we have not been able to move from understanding molecules to understanding entire systems.",0,,
另一个成功是削弱和压制了左翼反对派，使他能在在街上以及议会里没有重大对抗的情况下管理国家。,另一个成功是削弱和压制了右翼反对派，使他能在在街上以及议会里没有重大对抗的情况下管理国家。,"Another success was the weakening and suppression of the left-wing opposition, allowing him to run the country without major confrontations in the streets and in parliament.","Another success was to weaken and suppress the right-wing opposition, allowing him to run the country without major confrontations in the streets and in parliament.",0,,
印度不堪重负的火车开行不能靠热空气，但它们现在除了这些却貌似一无所有。,印度不堪重负的火车开行不能靠热空气，而它们现在除了这些却貌似一无所有。,"India's overwhelmed trains can't run on hot air, but they now seem to have nothing but that.","India's overwhelmed trains can't run on hot air, and they now seem to have nothing but that.",0,,
