事实上，只有当巴基斯坦不再为美国而战，当地武装份子才不会认为这是一场反对外来干涉的神圣战争。,事实上，唯有当巴基斯坦不再为美国而战，当地武装份子才不会认为这是一场反对外来干涉的神圣战争。,"In fact, only if Pakistan stopped fighting for the United States would local militants not see it as a holy war against foreign interference.","In fact, only when Pakistan stopped fighting for the United States would local militants not see it as a holy war against foreign interference.",0,,
也许欧洲会设计出一种适合希腊这样的小国的有序退出机制，但这种机制对于像意大利这样的大国并不适用。,或许欧洲会设计出一种适合希腊这样的小国的有序退出机制，但这种机制对于像意大利这样的大国并不适用。,"Perhaps Europe will devise an orderly exit mechanism suitable for small countries like Greece, but this mechanism does not work for large countries like Italy.","Perhaps Europe will devise an orderly exit mechanism suitable for small countries like Greece, but this mechanism does not work for large countries like Italy.",0,,
乌克兰人是位于分水岭的人民，那就是说，我们生活在一个大分水岭的其中一端。,乌克兰人是位于分水岭的人民，那就是说，我们生活在两个大分水岭的其中一端。,"Ukrainians are a people at a watershed, that is, we live at one end of a great divide.","Ukrainians are a people at a watershed, that is, we live at one end of two great watersheds.",0,,
为此我敦促裁军会议要么着手推动一个基于2009年共识的议程，要么重新选择另一方案展开工作。,因此我敦促裁军会议要么着手推动一个基于2009年共识的议程，要么重新选择另一方案展开工作。,"To that end, I urge the Conference on Disarmament to either embark on an agenda based on the 2009 consensus or to re-opt for another option to proceed.",I therefore urge the Conference on Disarmament to either embark on an agenda based on the 2009 consensus or to re-opt for another option to proceed.,0,,
两者之间区别似乎是因为近来这段高增长时期的城市化和现代部门的扩张是由国内需求驱动，而非以出口为导向的工业化。,两者之间区别似乎是因为近来这段高增长时期的城市化与现代部门的扩张是由国内需求驱动，而非以出口为导向的工业化。,The difference between the two seems to be because the recent period of high-growth urbanization and expansion of the modern sector has been driven by domestic demand rather than export-oriented industrialization.,The difference between the two seems to be because the recent period of high-growth urbanization and the expansion of the modern sector were driven by domestic demand rather than export-oriented industrialization.,0,,
与此相反，由当前对金融资产过度需求所引发的供需缺口则是经济衰退之源。,与此相反，由当前对金融资产过度需求所引发的内需缺口则是经济衰退之源。,"In contrast, the gap between supply and demand caused by the current excessive demand for financial assets is the source of the recession.","In contrast, the gap in domestic demand, caused by the current excessive demand for financial assets, is the source of the recession.",0,,
与世界两大名人名企合作，致力于地球的进步，这个机会并不是每天都有的。,与世界两大名人名企合作，致力于地球的进步，这个机会也不是每天都有的。,The opportunity to partner with two of the world's most famous companies to work on the progress of the planet is not every day.,The opportunity to partner with two of the world's most famous companies to work on the progress of the planet is not every day.,0,,
一战之前的20年，在第一次金融深化和全球化浪潮中，金融部门的增长速度是整个经济的4倍。,一战之前的20年，在第一次金融深化和全球化浪潮中，金融部门的增长速度是整个经济的10倍。,"In the 20 years before World War I, during the first wave of financial deepening and globalization, the financial sector grew four times faster than the entire economy.","In the 20 years before World War I, during the first wave of financial deepening and globalization, the financial sector grew 10 times faster than the entire economy.",0,,
一国要想平稳取消盯住汇率，唯有在人们对其经济充满信心时着手，让人们相信根据弹性的汇率既可以贬值，也可以升值。,一国要想平稳取消盯住汇率，唯有在人们对其经济充满信心时着手，让人们相信根据弹性的汇率既可以贬值，又可以升值。,"A country's smooth removal of pegging can only begin when people are confident in their economy, convincing people that a flexible exchange rate can both depreciate and appreciate.","A country's smooth removal of pegging can only begin when people are confident in their economy, convincing people that a flexible exchange rate can both depreciate and appreciate.",0,,
一名据称于2012年9月被两名警察强奸的妇女在提起申诉时被指公开猥亵。,一名据称于2011年9月被两名警察强奸的妇女在提起申诉时被指公开猥亵。,A woman who was allegedly raped by two police officers in September 2012 was accused of public molestation when filing a complaint.,A woman who was allegedly raped by two police officers in September 2011 was accused of public indecency when filing a complaint.,0,,
2014年前四个月，住房销售同比下降近7%，新建楼面面积下降22%以上。,2014年前四个月，住房销售同比下降近7%，新建楼面面积下降20%以上。,"In the first four months of 2014, housing sales fell nearly 7% year-on-year, and new floor space fell by more than 22%.","In the first four months of 2014, home sales fell nearly 7 percent year-on-year, and new floor space fell more than 20 percent.",0,,
2002年，小布什因为其在2001年9月11日恐怖袭击后的反应而饱受赞誉。,2002年，小布什因为其在2001年8月11日恐怖袭击后的反应而饱受赞誉。,"In 2002, George W. Bush was credited with his response to the terrorist attacks of September 11, 2001.","In 2002, George W. Bush was credited with his response to the terrorist attacks of August 11, 2001.",0,,
1990年，伊拉克入侵科威特，再次引发油价暴涨，当时，美国经济由于银行业危机已经进入了衰退。,1991年，伊拉克入侵科威特，再次引发油价暴涨，当时，美国经济由于银行业危机已经进入了衰退。,"Iraq's invasion of Kuwait in 1990 again triggered a surge in oil prices, at a time when the United States economy was already in recession as a result of the banking crisis.","Iraq's invasion of Kuwait in 1991 again triggered a surge in oil prices, at a time when the U.S. economy had entered a recession as a result of a banking crisis.",0,,
11月2日，随着世界正式承认结束对记者犯罪逍遥法外国际日，让我们共同努力使这些报道成为头条新闻。,12月2日，随着世界正式承认结束对记者犯罪逍遥法外国际日，让我们共同努力使这些报道成为头条新闻。,"On 2 November, as the world officially recognizes the International Day to End Impunity for Crimes against Journalists, let us work together to make these stories headlines.","On 2 December, as the world officially recognizes the International Day to End Impunity for Crimes against Journalists, let us work together to make these stories headlines.",0,,
11月22日，穆尔西借着捍卫革命之名，给自己赋予了绝对权力，当然这对于埃及来说并不新鲜。,10月22日，穆尔西借着捍卫革命之名，给自己赋予了绝对权力，当然这对于埃及来说并不新鲜。,"On November 22, Morsi gave himself absolute power in the name of defending the revolution, which of course is not new for Egypt.","On October 22, Morsi gave himself absolute power in the name of defending the revolution, which of course is not new for Egypt.",0,,
首先，它必须在其他关键事务上与欧盟开展强劲的合作，比如安全、外交和气候政策。,首先，它必须在其他关键事务上同欧盟开展强劲的合作，比如安全、外交和气候政策。,"First, it must work strongly with the EU on other key issues, such as security, foreign affairs and climate policy.","First, it must work strongly with the EU on other key issues, such as security, foreign affairs and climate policy.",0,,
隐藏在森林里的神枪手瞄准开枪，只是这一次他们的目标不是黑熊，而是齐奥塞斯库本人。,隐藏在森林里的神枪手瞄准开枪，只是这一次他们的目标不是黑熊，而是里奥塞斯库本人。,"The sharpshooters hidden in the forest aim and shoot, only this time their target is not the black bear, but Ceausescu himself.","The sharpshooters hidden in the forest aim and shoot, only this time their target is not the black bear, but Riusescu himself.",0,,
随着信息和通讯技术的不断革命，即便发展所需的很多商品成本会不断上涨，但电话和电脑所需的成本却会越来越低。,随着信息和通讯技术的不断革命，即便发展所需的很多商品成本会不断上涨，但电话和电脑所需的成本也会越来越低。,"With the continuous revolution in information and communication technology, while the cost of many goods required for development will continue to rise, the cost of telephones and computers will become lower and lower.","With the continuous revolution in information and communication technology, even if the cost of many goods needed for development will continue to rise, the cost of telephones and computers will become lower and lower.",0,,
银行面临着更高的资本准备金的要求，这迫使他们根据自身所拥有的资源，而不得不减少对外借贷。,银行面临着更高的资本准备金的要求，这迫使他们依据自身所拥有的资源，而不得不减少对外借贷。,"Banks face higher capital reserve requirements, which force them to borrow less based on the resources they have.","Banks face higher capital reserve requirements, which force them to borrow less depending on the resources they have.",0,,
那种从太空看到的地球图像具有深刻的心理影响，并且我们都看到了这种影响。,那种从太空看到的地球图像具有深刻的心理影响，而且我们都看到了这种影响。,"That kind of image of Earth seen from space has a profound psychological impact, and we've all seen it.","That kind of image of Earth seen from space has a profound psychological impact, and we've all seen it.",0,,
通过这一程序，增长合作战略的各个部分得以被识别、评估和组装。,通过这一程序，增长合作战略的各个部分可以被识别、评估和组装。,"Through this process, the various components of the growth cooperation strategy are identified, evaluated and assembled.","Through this process, the various parts of the growth partnership strategy can be identified, evaluated and assembled.",0,,
通过基于技能的研讨班和假新闻识别运动，我们试图用能够辨别俄罗斯伪造的消息的工具来武装人民。,通过基于技能的研讨班和假新闻识别运动，我们试图用能够识别俄罗斯伪造的消息的工具来武装人民。,"Through skills-based workshops and fake news identification campaigns, we try to arm people with tools that can discern fake Russian news.","Through skills-based workshops and fake news identification campaigns, we try to arm people with tools that can identify fake news in Russia.",0,,
这项原则被写入了很多国际文件，其中最早的是1948年发表的《世界人权宣言》。,这项原则被写入了许多国际文件，其中最早的是1948年发表的《世界人权宣言》。,"This principle has been enshrined in many international documents, the earliest of which is the Universal Declaration of Human Rights, promulgated in 1948.","This principle is enshrined in many international documents, the earliest of which is the Universal Declaration of Human Rights, issued in 1948.",0,,
这里曾经是举世公认的创新发源地，而如今，这座全球首屈一指的科技枢纽正在日益受到质疑和怨恨。,这里曾经是举世公认的创新发源地，而如今，这座全球首屈一指的科技枢纽正在日益受到质疑与怨恨。,"Once recognized as the birthplace of innovation, the world's premier tech hub is increasingly being questioned and resented.","Once recognized as the birthplace of innovation, the world's premier tech hub is increasingly being questioned and resented.",0,,
这部法律目前只影响到什叶派少数族裔，不过或许会影响到可能限制非什叶派妇女权利的即将表决的法案。,这部法律目前只影响到什叶派少数族裔，不过也许会影响到可能限制非什叶派妇女权利的即将表决的法案。,"The law currently affects only Shia minorities, but may affect upcoming bills that may restrict the rights of non-Shia women.","The law currently affects only Shia minorities, but may affect upcoming bills that may restrict the rights of non-Shia women.",0,,
这让像萨尔科奇那样的欧洲央行的批评者安慰，并且给他们压力，由于欧洲央行通胀的偏向对欧元的影响而放弃之。,这让像马尔科奇那样的欧洲央行的批评者安慰，并且给他们压力，由于欧洲央行通胀的偏向对欧元的影响而放弃之。,This comforts critics of the ECB like Sarkozy and puts pressure on them to abandon it because of the impact of the ECB's inflationary bias on the euro.,This comforts ECB critics like Markozy and puts pressure on them to abandon it because of the impact of the ECB's inflationary bias on the euro.,0,,
这样看来，她在商业和政治这两大职业领域中都有出色的表现，其魅力也不容小觑。,这样看来，她在商业和政治这两大职业领域中均有出色的表现，其魅力也不容小觑。,"In this way, she has excelled in both professional fields of business and politics, and her charm cannot be underestimated.","In this way, she has excelled in both business and politics, and her charm cannot be underestimated.",1,professional fields of,
这是一种其中通过克隆出原有产品的虚拟单位，从现有的房贷证券中衍生出来的复杂组合证券产品。,这是一种其中通过克隆出原有产品的虚拟单位，从已有的房贷证券中衍生出来的复杂组合证券产品。,This is a complex portfolio of securities products derived from existing mortgage securities by cloning virtual units of the original product.,This is a complex portfolio of securities products derived from existing mortgage securities by cloning virtual units of the original product.,0,,
这对于政府官员来说并不总是一件也让人舒服的事情，并且在公开敏感材料的问题上还存在着激烈的斗争。,这对于政府官员来说并不总是一件也让人舒服的事情，并且在公开敏感材料的问题上也存在着激烈的斗争。,"This is not always a comfortable thing for government officials, and there is a fierce struggle over the disclosure of sensitive material.","This is not always a comfortable thing for government officials, and there is a fierce struggle over the disclosure of sensitive material.",0,,
这些海滩让我们知道，团结就是力量，能够摧毁一切危险，不管它多么大。,这些海滩使我们知道，团结就是力量，能够摧毁一切危险，不管它多么大。,"These beaches show us that unity is strength and can destroy all dangers, no matter how great it may be.","These beaches show us that unity is strength and can destroy all dangers, no matter how great they may be.",0,,
这些数字并不能识别最优秀的环境友好型解决方案，只能揭示哪些公司目前排放了最多的温室气体。,这些数字并不能识别最优秀的环境友好型解决方案，只能揭示哪些公司当前排放了最多的温室气体。,"These numbers do not identify the best environmentally friendly solutions, but only which companies currently emit the most greenhouse gases.","These numbers do not identify the best environmentally friendly solutions, but only which companies currently emit the most greenhouse gases.",0,,
这些国家如今需要痛苦、深远的改革以实现经济繁荣，这既是目标，也是文化变革的先决条件。,这些国家现今需要痛苦、深远的改革以实现经济繁荣，这既是目标，也是文化变革的先决条件。,"These countries today need painful, far-reaching reforms to achieve economic prosperity, both as a goal and as a prerequisite for cultural change.","These countries today need painful, far-reaching reforms to achieve economic prosperity, both as a goal and as a prerequisite for cultural change.",0,,
这也是为什么欧洲议会在11月全票通过，只有当该行为规范具备法律约束力时才能解除对华武器禁售。,这也是为什么欧洲议会于11月全票通过，只有当该行为规范具备法律约束力时才能解除对华武器禁售。,That's why the European Parliament unanimously voted in November to lift the ban on arms sales to China only if the code of conduct is legally binding.,That's why the European Parliament unanimously voted in November to lift the ban on arms sales to China only if the code of conduct is legally binding.,0,,
这两大领域疲软已久，是周期动态中的主要拖累因素，在传统上，周期动态总会将美国带出暂时性的经济减速。,这两大领域疲软已久，是周期动态中的主要拖累因素，在传统上，周期动态总会将中国带出暂时性的经济减速。,"These two areas have been weak for a long time and are the main drags on cyclical dynamics, which have traditionally brought the US out of a temporary economic slowdown.","These two areas have been weak for a long time and are the main drags on cyclical dynamics, which have traditionally brought China out of a temporary economic slowdown.",0,,
这一自利冲动可以从欧洲议会主席马丁·舒尔茨激烈的评论中一窥端倪。,这一自利冲动可以从欧洲议会主席马丁·舒尔茨猛烈的评论中一窥端倪。,"This self-interested impulse can be seen in the fiery comments of the president of the European Parliament, Martin Schulz.","This self-interested impulse can be seen in the fierce comments of the president of the European Parliament, Martin Schulz.",0,,
这一政治关系也许给这家银行续了几年性命，直到前后矛盾的零碎干预导致市场方案已经无从下手。,这一政治关系或许给这家银行续了几年性命，直到前后矛盾的零碎干预导致市场方案已经无从下手。,"This political relationship may have given the bank a few years of life, until inconsistent piecemeal interventions made it impossible to start with a market solution.","This political relationship may have given the bank a few years of life, until contradictory piecemeal interventions made it impossible to start with a market solution.",0,,
这一回，问题仍不在于谁抛出了更好的政策或是更靠谱的想法，而在于演讲的表现。,这一回，问题仍不在于谁提出了更好的政策或是更靠谱的想法，而在于演讲的表现。,"This time, the question is not who throws out better policies or more reliable ideas, but the performance of the speech.","This time, the question is not who came up with better policies or more credible ideas, but how well the speech performed.",0,,
过去一年来，阿卜杜拉国王十分坚定地认为约旦人民应该在2012年之前获得自由公平选举的权利。,过去一年来，阿卜杜拉国王十分坚定地认为约旦公民应该在2012年之前获得自由公平选举的权利。,"Over the past year, King Abdullah has been very adamant that the Jordanian people deserve the right to free and fair elections by 2012.","Over the past year, King Abdullah has been a firm believer that Jordanian citizens should have the right to free and fair elections by 2012.",1,very,
跟一个半世纪前的贝隆一样，2000年的普京承诺要驯服在前任鲍里斯?叶利钦时期恣意妄为的资本主义。,和一个半世纪前的贝隆一样，2000年的普京承诺要驯服在前任鲍里斯?叶利钦时期恣意妄为的资本主义。,"Like Veron a century and a half ago, Putin in 2000 promised to tame capitalism that was unbridled under his predecessor, Boris Yeltsin.","Like Veron a century and a half ago, Putin in 2000 promised to tame capitalism that was unbridled under his predecessor, Boris Yeltsin.",0,,
财政政策是显而易见的替代方案，但国会在最糟糕的时候选择了减税，这使得真正需要的时候不再有刺激空间。,财政政策是显而易见的替代方案，但社会在最糟糕的时候选择了减税，这使得真正需要的时候不再有刺激空间。,"Fiscal policy is the obvious alternative, but Congress opted for tax cuts at the worst of time, leaving no room for stimulus when it was really needed.","Fiscal policy is the obvious alternative, but society opted for tax cuts at the worst of times, leaving no room for stimulus when it was really needed.",0,,
该项目于2014年启动，并已经在埃塞俄比亚和塞内加尔等两个非洲国家得到成功实施。,该项目在2014年启动，并已经在埃塞俄比亚和塞内加尔等两个非洲国家得到成功实施。,"The project was launched in 2014 and has already been successfully implemented in two African countries, including Ethiopia and Senegal.","The project was launched in 2014 and has already been successfully implemented in two African countries, namely Ethiopia and Senegal.",1,including,namely
该理由的支持者难以解释英国可以与欧盟缔结何种贸易和合作伙伴协定，更不用说这些协定如何能够优于当前安排了。,该理由的支持者难以解释美国可以与欧盟缔结何种贸易和合作伙伴协定，更不用说这些协定如何能够优于当前安排了。,"Proponents of this argument struggle to explain what kind of trade and partnership agreements the UK could conclude with the EU, let alone how they can be superior to current arrangements.","Proponents of this rationale struggle to explain what kind of trade and partnership agreements the United States could conclude with the EU, let alone how they could be superior to current arrangements.",0,,
该提议的逻辑是如果股东频繁买卖自身的股票，企业高管就被迫要在每季度都实现高收益，以确保股价不会下降。,该提议的逻辑是如果股东频繁买卖自身的股票，企业高管将被迫要在每季度都实现高收益，以确保股价不会下降。,"The logic of the proposal is that if shareholders frequently buy and sell their shares, corporate executives are forced to achieve high returns every quarter to ensure that the share price does not fall.","The logic of the proposal is that if shareholders frequently buy and sell their shares, corporate executives will be forced to achieve high returns every quarter to ensure that the stock price does not fall.",0,,
该合同将以标准普尔及蔡斯席勒住房价格指数进行结算，该指数源于我和同事蔡斯近20年前开发研究得出的学术成果。,该合同将以标准普尔及蔡斯席勒住房价格指数进行结算，该指数基于我和同事蔡斯近20年前开发研究得出的学术成果。,"The contract will be settled using the S&P and Chase Schiller Housing Price Index, which is based on academic research developed by my colleague Chase and I nearly 20 years ago.","The contract will be settled using the S&P and Chase Schiller Housing Price Index, which is based on academic research developed by my colleague Chase and I nearly 20 years ago.",0,,
话虽如此，结局肯定不会像电影那样戏剧化，因为美联储不像汉斯那样以接管市场为目标。,话虽如此，结局一定不会像电影那样戏剧化，因为美联储不像汉斯那样以接管市场为目标。,"That being said, the ending certainly won't be as dramatic as the movie, as the Fed isn't as targeted as Hans is to take over the market.","That being said, the ending is certainly not as dramatic as the movie, as the Fed is not as targeted as Hans is to take over the market.",0,,
许多非洲国家利用过去十年实行了有效和可持续的经济政策，而这些政策带来了强劲的经济增长以及低通货膨胀。,许多非洲国家利用过去十年实行了高效和可持续的经济政策，而这些政策带来了强劲的经济增长以及低通货膨胀。,Many African countries have used the past decade to implement effective and sustainable economic policies that have led to strong economic growth and low inflation.,Many African countries have used the past decade to implement efficient and sustainable economic policies that have led to strong economic growth and low inflation.,0,,
