S_s,S_f,T_s,T_f,Violation,Fine-grained Violations in T_s,Fine-grained Violations in T_f
这些农民不确定自己是否能够在下一季还能控制自己的农场，因此不会进行长期规划。,这些农民不确定自己是否能够在下一季才能控制自己的农场，因此不会进行长期规划。,These farmers are not sure if they will be able to control their farms next season and therefore do not plan for the long term.,These farmers are not sure if they will be able to control their farms next season and therefore do not plan for the long term.,0,,
虽然所有决策都会呈交董事会签字批准，但那时候关键决策早就制定完毕了。,虽然所有决策都会呈交董事会签字批准，但那时候关键决策早就拟定完毕了。,"While all decisions are submitted to the board for approval, key decisions are already in place.","While all decisions are submitted to the board for approval, key decisions are already in place.",0,,
而另一方面，骗税则涉及到伪造文件，因而就牵涉到更多的犯罪行为。,而另一方面，骗税也涉及到伪造文件，因而就牵涉到更多的犯罪行为。,"Tax fraud, on the other hand, involves falsifying documents, which leads to more criminal acts.","On the other hand, tax fraud also involves falsifying documents, which leads to more criminal acts.",0,,
而且无论有没有阿萨德的空军配合，全体叙利亚民众都将全力抵抗伊斯兰国。,并且无论有没有阿萨德的空军配合，全体叙利亚民众都将全力抵抗伊斯兰国。,"And with or without Assad's air force, all Syrians will resist ISIS with all their might.","And with or without Assad's air force, all Syrians will resist ISIS with all their might.",0,,
纳亚尔认为人们早就知道反应堆的设计存在根本缺陷，尽管只有日本当局能够证实。,雷亚尔认为人们早就知道反应堆的设计存在根本缺陷，尽管只有日本当局能够证实。,"Nayar believes that fundamental flaws in the reactor's design have long been known, although only Japanese authorities have been able to confirm it.","Real believes that the design of the reactor has long been known to be fundamentally flawed, although only Japanese authorities have been able to confirm it.",0,,
甚至在布什就职之前，他们就鼓吹推翻萨达姆·侯赛因，911之后又把布什拉进了自己的事业。,甚至在布什就职之前，他们也鼓吹推翻萨达姆·侯赛因，911之后又把布什拉进了自己的事业。,"Even before Bush took office, they advocated the overthrow of Saddam Hussein, and after 911 they pulled Bush into their own business.","Even before Bush took office, they advocated the overthrow of Saddam Hussein, and after 911 they pulled Bush into their own business.",0,,
此外，拉加德认识到当今世界面临着三大最重要的挑战，并针对它们展开行动。,此外，拉加德认识到当今世界面临着四大最重要的挑战，并针对它们展开行动。,"In addition, Lagarde recognizes and acts on the three most important challenges facing the world today.","In addition, Lagarde recognizes and acts on the four most important challenges facing the world today.",0,,
当然，这并不意味着单一市场不能在存在边境控制或多货币的情况下运转。,当然，这并不意味着单一市场只能在存在边境控制或多货币的情况下运转。,"Of course, this does not mean that the single market cannot operate in the presence of border controls or multiple currencies.","Of course, this does not mean that the single market can only operate in the presence of border controls or multiple currencies.",0,,
尽管津巴布韦政府当局声称这一侵犯人权的惨案已经终结，但马朗钻石所蕴含的道德问题却引起了人们进一步的质疑。,尽管津巴布韦政府当局声称这一侵犯人权的惨案已经终结，但马朗钻石所蕴含的道德问题也引起了人们进一步的质疑。,"While Zimbabwean authorities claim that this tragic human rights violation is over, the moral issues underlying the Marang diamond raise further questions.","While Zimbabwean authorities claim that this tragic human rights violation is over, the moral issues underlying the Malang diamond raise further questions.",0,,
如果认定专家另有目的或服务于特殊利益集团则不太可能获得民众满意的结果。,如果认定专家另有目的或服务于特殊利益集团则不太可能取得民众满意的结果。,"If the expert is determined to have another purpose or serves a special interest group, it is unlikely that a satisfactory outcome will be obtained.","If experts are determined to have other purposes or serve special interest groups, it is unlikely that a satisfactory outcome will be achieved.",0,,
如果回国已经安全，那些尚未获得永久居留权或公民权的人就应该回国。,如果回国已经安全，那些还未获得永久居留权或公民权的人就应该回国。,"If it is safe to return, those who have not yet been granted permanent residency or citizenship should do so.","If it is safe to return, those who have not yet been granted permanent residency or citizenship should do so.",0,,
如果冒着过度概括的微小风险的话，我们可以说第一个阵营主要由北欧人组成，而第二个阵营则是南欧人做主角。,如果冒着过度概括的微小风险的话，我们可以说第一个阵营主要由北欧人组成，而第二个阵营则是东欧人做主角。,"If we risk overgeneralizing, we can say that the first camp is mainly composed of northern Europeans, while the second camp is dominated by southern Europeans.","If we risk overgeneralizing, we can say that the first camp is mainly composed of Nordics, while the second camp is dominated by Eastern Europeans.",0,,
如果他要向欧盟各国领导人保证他们应该重新任命他的话，那么他就需要表明他的第二个任期会给人以新的希望。,如果他要向欧盟各国领导人保证他们应该重新任命他的话，那么他还需要表明他的第二个任期会给人以新的希望。,"If he is to assure EU leaders that they should reappoint him, he needs to show that his second term offers new hope.","If he is to assure EU leaders that they should reappoint him, he also needs to show that his second term offers new hope.",0,,
墨西哥总统恩里克·佩尼亚·尼托治下的年经济增长率只有2％，这可是不正常的，如果没法增加外国投资，经济也不能更快地扩张。,墨西哥总统恩里克·佩尼亚·尼托治下的年经济增长率只有3％，这可是不正常的，如果没法增加外国投资，经济也不能更快地扩张。,"Mexican President Enrique Pe?a Nito's annual economic growth rate of only 2% is not normal, and the economy cannot expand faster without increasing foreign investment.","Mexican President Enrique Pe?a Nito's annual economic growth rate of only 3% is not normal, and the economy cannot expand faster without increasing foreign investment.",0,,
在俄罗斯法律和民主制度的表面隐藏的同样专横的暴君统治。,在俄罗斯法律和民主制度的表面隐藏的同样蛮横的暴君统治。,The same tyrannical rule is hidden on the surface of Russian law and democracy.,The same tyrannical tyrants hide on the surface of Russian law and democracy.,0,,
南非企业不能坐等政客为此做些什么，而应该加强深入更加广泛的人口细分。,南非企业不能坐等政客对此做些什么，而应该加强深入更加广泛的人口细分。,"South African businesses cannot wait for politicians to do something about it, but should strengthen deeper and broader demographic segmentation.","South African businesses cannot wait for politicians to do something about this, but should step up deeper and broader demographic segmentation.",0,,
军人统治集团一面在残酷地对待缅甸的民众，一面却在对世界隐瞒它的暴行。,军人统治集团一面在冷酷地对待缅甸的民众，一面却在对世界隐瞒它的暴行。,The military ruling clique is brutalizing the people of Myanmar while hiding its atrocities from the world.,The military ruling clique is treating Myanmar's people coldly while hiding its atrocities from the world.,0,,
例如，德国计划仿效其他国家的做法，实行法定最低工资。,例如，德国计划仿效其它国家的做法，实行法定最低工资。,"Germany, for example, plans to follow the example of other countries and introduce a statutory minimum wage.","Germany, for example, plans to follow the example of other countries and introduce a statutory minimum wage.",0,,
但最近也取得了一些正面发展，那就是建立了一些强大的公共机构。,但最近也取得了一些正面发展，那就是设立了一些强大的公共机构。,"But there have also been some positive developments recently, namely the establishment of some strong public institutions.","However, there have also been some positive developments recently, namely the establishment of some strong public institutions.",0,,
但是，如今的埃及充满着不确定性，今天选举出来的政府能否在哪怕一年时间里保持有同样的支持率都是个问题。,但是，如今的埃及充满着不确定性，今天选举出来的政府能否在哪怕一年时间里保持有同样的支持率也是个问题。,"But Egypt today is fraught with uncertainty, and it is questionable whether the government elected today will maintain the same approval rating for even a year.","But Egypt today is fraught with uncertainty, and it is a question whether the government elected today will be able to maintain the same approval rating for even a year.",1,,be able to
但是，在大多数情况下，他们甚至根本就不考虑这一可能性。,可是，在大多数情况下，他们甚至根本就不考虑这一可能性。,"However, in most cases, they do not even consider this possibility at all.","In most cases, however, they don't even consider this possibility.",1,,at all
但是，在国家之间，即便是核威慑也比乍看上去更复杂，在网络空间中的威慑更是如此。,但是，在国家之间，即便是核威慑都比乍看上去更复杂，在网络空间中的威慑更是如此。,"But even nuclear deterrence between states is more complex than it may seem at first glance, especially in cyberspace.","But even nuclear deterrence between states is more complex than it might seem at first glance, and deterrence in cyberspace is even more so.",0,,
但是在目前这种情况下，最重要的是人们普遍认为俄罗斯人尚未准备好履行公民的责任。,但是在目前这种情况下，最重要的是人们普遍认为俄罗斯人还未准备好履行公民的责任。,"But in the current situation, the most important thing is the widespread belief that Russians are not ready to fulfill their responsibilities as citizens.","But in the current situation, the most important thing is the widespread belief that Russians are not ready to fulfill their civic responsibilities.",0,,
但接下来的两年中，飓风造成的损失远低于平均情况，几乎在2006年彻底消失。,但接下来的两年中，飓风造成的损失均低于平均情况，几乎在2006年彻底消失。,"But over the next two years, hurricanes caused far less than average damage, almost disappearing in 2006.","But over the next two years, hurricanes caused below-average damage and almost disappeared in 2006.",0,,
传统看法认为所有的网络供水和公共卫生系统都是好的投资，就像传统看法可能犯错误一样，认定所有水坝都是不好的投资同样也可能出现偏差。,传统看法认为所有的网络供水和公共卫生系统都是好的投资，就像传统看法可能犯错误一样，认定所有堤坝都是不好的投资同样也可能出现偏差。,"Just as the conventional view that all networked water and sanitation systems are good investments can be wrong, so too can the conventional view that all dams are bad investments.","Just as conventional wisdom holds that all network water and sanitation systems are good investments, so too can the conventional wisdom that all are bad investments.",1,,wisdom
不过欧洲人则偏重用更加系统的法治手段来解决问题，也就是所谓的全球公共物品模式。,不过欧洲人则偏重用更加系统的法治手段去解决问题，也就是所谓的全球公共物品模式。,"But Europeans prefer to use a more systematic approach to the rule of law, the so-called global public goods model.","But Europeans prefer to use a more systematic approach to the rule of law, the so-called global public goods model.",0,,
不管怎样，在消费逐步减慢的阶段，即使公司富有现金，一般情况下也不会去扩大投资。,不管怎样，在消费逐步减慢的阶段，即使公司富有现金，一般情况下都不会去扩大投资。,"In any case, during the gradual slowdown of consumption, even if the company has cash, it generally does not expand investment.","In any case, during the gradual slowdown of consumption, even if companies are rich in cash, they generally do not expand their investment.",1,,rich
虽然古巴政府已封堵了该博客所在的网站，但它还是以多种语言在全世界广泛传播，在古巴国内也以光盘和闪存为传播途径。,虽然古巴政府已封堵了该博客所在的网站，但它还是以多种语言在全世界广泛传播，在古巴国内也以光盘或闪存为传播途径。,"Although the Cuban government has blocked the website on which the blog is located, it is widely distributed around the world in multiple languages, as well as through CD-ROMs and flash memory in Cuba.","Although the Cuban government has blocked the website on which the blog is located, it is widely distributed around the world in multiple languages, and also through CD-ROMs or flash memory in Cuba.",0,,
在此之前的1982年，美国从世界其他地区净赚取360亿美元左右的金融收入，这是由此前投资在国外的资本产生的。,在此之前的1982年，美国从世界其他地区净赚取10亿美元左右的金融收入，这是由此前投资在国外的资本产生的。,"Prior to that, in 1982, the United States earned a net financial income of about $36 billion from the rest of the world, generated by capital previously invested abroad.","Prior to that, in 1982, the United States earned a net financial income of about $1 billion from the rest of the world, generated by capital previously invested abroad.",0,,
其必然的结果，就像查尔斯·达尔文首先描述的，是对那些最适合生存，尤其是，在已有的条件下制造后代的物种的选择。,其必然的结果，就像查尔斯·达尔文首先描述的，是对那些最适合生存，尤其是，在已有的条件下创造后代的物种的选择。,"The inevitable result, as Charles Darwin first described, is the selection of species that are best suited to survive, especially to produce offspring under existing conditions.","The inevitable result, as Charles Darwin first described, is the selection of species that are best suited to survive, especially to create offspring under pre-existing conditions.",0,,
那时大型企业被认为是威胁，一个原因就是因为这些公司对资产实行垄断，而这些资产对很多美国大众来说是至关重要的。,那时大型企业被认为是威胁，一个原因就是因为这些公司对资产实行垄断，而这些资产对许多美国大众来说是至关重要的。,Big business was considered a threat in part because they had a monopoly on assets that were vital to much of the American public.,"Big business was considered a threat at the time, in part because they had a monopoly on assets that were vital to many Americans.",1,,at the time
尽管如此，印度可以在不用承担不必要风险的情况下做很多事情，以拉詹为首的委员会在几年前便给出了详细的计划。,尽管如此，印度可以在不用承担不必要风险的情况下做很多事情，以拉詹为首的委员会在几年前便提出了详细的计划。,"Still, India can do a lot without taking unnecessary risks, and the committee headed by Rajan gave a detailed plan several years ago.","Still, India can do much without taking unnecessary risks, and the committee headed by Rajan came up with a detailed plan several years ago.",0,,
在6月5日，瑞士选民以77％比23％的压倒性多数否决了向每个公民发放无条件基本收入的提案。,在5月5日，瑞士选民以77％比23％的压倒性多数否决了向每个公民发放无条件基本收入的提案。,"On June 5, Swiss voters rejected an overwhelming 77% to 23% proposal to distribute an unconditional basic income to every citizen.","On May 5, Swiss voters rejected an overwhelming 77% to 23% proposal to distribute an unconditional basic income to every citizen.",0,,
在1991年，美国组建了自二战以来最为强大的国际联合部队，并且在一场完全合法的战争中率领这一部队。,在1946年，美国组建了自二战以来最为强大的国际联合部队，并且在一场完全合法的战争中率领这一部队。,"In 1991, the United States formed the most powerful joint international force since World War II and led it in a perfectly legitimate war.","In 1946, the United States formed the most powerful international coalition force since World War II and led it in a completely legitimate war.",0,,
在1968年5月革命过去39年后，法国人渴望的是工作，而不是爱情，这一点萨尔科齐看得比如何人都要清楚。,在1968年5月革命过去39年后，法国人渴望的是工作，而不是爱情，这一点马尔科齐看得比如何人都要清楚。,"Thirty-nine years after the May 1968 revolution, the French yearn for work, not love, as Sarkozy sees better than anyone.","Thirty-nine years after the May 1968 revolution, the French yearn for work, not love, as Markozy knows better than anyone.",0,,
顾名思义，与超级大国结盟永远是不平等的，因此，从长期看，与美国建立紧密关系的努力对于印度的战略自主传统不利。,顾名思义，与超级大国结盟永远是不平等的，因此，从长期看，同美国建立紧密关系的努力对于印度的战略自主传统不利。,"By definition, alliances with superpowers will always be unequal, so efforts to forge closer ties with the United States are detrimental to India's tradition of strategic autonomy in the long run.","By definition, alliances with superpowers will always be unequal, so efforts to forge a closer relationship with the United States are detrimental to India's tradition of strategic autonomy in the long run.",0,,
随着里约+20签署协议的落实，全球社会应当在今后20年为促进地方、全国和国际层面的可持续发展采取更大胆的行动。,随着北约+20签署协议的落实，全球社会应当在今后20年为促进地方、全国和国际层面的可持续发展采取更大胆的行动。,"With the implementation of the Rio+20 agreement, the global community should take bolder actions over the next 20 years to promote sustainable development at the local, national and international levels.","With the implementation of the NATO+20 agreement, the global community should take bolder actions over the next 20 years to promote sustainable development at the local, national and international levels.",0,,
重要的政治领袖，特别是美俄两个核大国的政治领袖，对今天已有的风险以及明天即将出现的风险有着清楚的认识。,重要的政治领袖，特别是美俄两个核大国的政治领袖，对昨天已有的风险以及明天即将出现的风险有着清楚的认识。,"Important political leaders, especially those of the two nuclear powers of the United States and Russia, have a clear understanding of the risks that exist today and those that will arise tomorrow.","Important political leaders, especially those of the two nuclear powers of the United States and Russia, have a clear understanding of the risks that existed yesterday and those that will arise tomorrow.",0,,
通过理解并从世界各地引进有效的创新，非洲能够在技术上赶超更加发达的国家，构建生产更先进、价值更高的商品的能力。,通过理解并从世界各地引进有效的创新，非洲能够从技术上赶超更加发达的国家，构建生产更先进、价值更高的商品的能力。,"By understanding and introducing effective innovations from around the world, Africa can catch up technologically with more developed countries and build the capacity to produce more advanced and higher-value goods.","By understanding and importing effective innovations from around the world, Africa can technologically catch up with more developed countries and build the capacity to produce more advanced and valuable goods.",0,,
这一单位只不过是一个消费者物价指数，名称简单，每天公布，这样人们就可以使用这一单位及名称来以实际价格报价。,这个单位只不过是一个消费者物价指数，名称简单，每天公布，这样人们就可以使用这一单位及名称来以实际价格报价。,"This unit is nothing more than a consumer price index, with a simple name, published daily so that people can use the unit and its name to quote at real prices.","This unit is nothing more than a consumer price index, with a simple name, published daily, so that people can use the unit and name to quote at the actual price.",0,,
当一个国家专门从事于某一个领域之时，资本和劳力就会比其他领域更快地流向这一领域。,当一个国家专门从事于某一个领域之时，资本和劳力便会比其他领域更快地流向这一领域。,"When a country specializes in one area, capital and labor flow to that area more quickly than others.","When a country specializes in one area, capital and labor flow to that area more quickly than others.",0,,
如果，在欧洲层面的监管只能适用于年景好的时候，而年景糟糕的时候则由各国的纳税人买单，这个系统必定失败。,如果，在欧洲层面的监管只能适用于年景好的时候，而年景糟糕的时候则由各国的纳税人买单，这个系统肯定失败。,"If regulation at the European level can only be applied in good times and taxpayers in bad times are paid for by countries, the system is bound to fail.","If regulation at the European level can only be applied in good times, and taxpayers in various countries pay for bad times, the system will surely fail.",0,,
如果我们还需要提醒的话，那么，这一事件让我们回想起来2001年9月11日对纽约和华盛顿的恐怖主义袭击。,如果我们还需要提醒的话，那么，这一事件让我们回想起来2001年8月11日对纽约和华盛顿的恐怖主义袭击。,"If we need to be reminded, this incident reminds us of the terrorist attacks on New York and Washington on 11 September 2001.","If we need to be reminded, this incident reminds us of the terrorist attacks on New York and Washington on 11 August 2001.",0,,
同样地，如果科技创新现在能在短短的几年或者几个月内改变主要的产业，长期投资就不会像过去那样有意义。,同样地，如果科技创新现在能在短短的几年或者几个月内改变主要的产业，长期投资也不会像过去那样有意义。,"Similarly, if technological innovation can transform major industries in just a few years or months, long-term investment will not make as much sense as it once was.","Similarly, if technological innovation can transform major industries in just a few years or months, long-term investment will not make as much sense as it once did.",0,,
但是，如何从这场总统大选中来解读美国，不仅对美国人，对全世界来说，意义都颇为重大。,但是，如何从这场总统大选中来解读美国，不仅对美国人，对全世界来说，意义也颇为重大。,"However, how to interpret the United States from this presidential election is of great significance not only to Americans, but also to the world.","However, how to interpret the United States from this presidential election is of great significance not only to Americans but also to the world.",0,,
但在实践中，这不会发生，因为这些国家缺少能力、经验，最重要的是缺少关于需要做什么、由谁去做的共识。,但在实践中，这不会发生，因为这些国家缺少能力、经验，更重要的是缺少关于需要做什么、由谁去做的共识。,"But in practice, this does not happen because these countries lack the capacity, the experience and, most importantly, a consensus on what needs to be done and by whom.","But in practice, this does not happen because these countries lack the capacity, experience and, more importantly, a common understanding of what needs to be done and by whom.",0,,
"7月份第一批被记录的数字表明，在2015年4月到2016年3月期间，英格兰发生了5,702起新的割礼案件。","7月份第一批被记录的数字表明，在2015年4月到2016年3月期间，英格兰发生了3,702起新的割礼案件。","The first recorded figures in July showed 5,702 new cases of circumcision in England between April 2015 and March 2016.","The first recorded figures in July indicate 3,702 new cases of circumcision in England between April 2015 and March 2016.",0,,
