他3岁的孩子虽然和其他30万名儿童一样在饮用了掺假奶粉后得病，但经过治疗后幸运地迅速痊愈了。,他4岁的孩子虽然和其他30万名儿童一样在饮用了掺假奶粉后得病，但经过治疗后幸运地迅速痊愈了。,"His 3-year-old, who, like 300,000 other children, fell ill after drinking adulterated milk powder, but was fortunate to recover quickly after treatment.","Like 300,000 other children, his 4-year-old became ill after drinking adulterated milk powder, but was fortunate to recover quickly after treatment.",0,,
从现在起到明年1月20日就职，他需要磨砺他的政策。,从现在起到明年2月20日就职，他需要磨砺他的政策。,"Between now and his inauguration on Jan. 20, he needs to sharpen his policies.",He needs to sharpen his policies between now and his inauguration on February 20.,0,,
今年，被迫流离失所的人数达到了历史新高，联合国也将在9月19日召开峰会讨论这个问题。,今年，被迫流离失所的人数达到了历史新高，联合国也将在7月19日召开峰会讨论这个问题。,"This year, the number of forcibly displaced people is at an all-time high, and the United Nations will convene a summit on 19 September to discuss the issue.","This year, the number of forcibly displaced people is at an all-time high, and the United Nations will convene a summit on 19 July to discuss the issue.",0,,
"事实上，研究表明如果所有育龄妇女都能接受中学教育，那么五岁以前死亡的儿童人数每年将下降约350,000人。","事实上，研究表明如果所有育龄妇女都能接受中学教育，那么6岁以前死亡的儿童人数每年将下降约350,000人。","In fact, studies show that if all women of childbearing age had access to secondary education, the number of children dying before their fifth birthday would drop by about 350,000 a year.","In fact, studies show that if all women of childbearing age had access to secondary education, the number of children dying before the age of six would drop by about 350,000 per year.",0,,
中印两国一直在全球各地往返奔波，签署在经济上和政治上都是成本巨大的协议来试图锁定新的产油国的产油。,中印两国一直在全球各地往返奔波，签署在经济上和政治上都是成本巨大的协议来企图锁定新的产油国的产油。,"China and India have been traveling back and forth around the world, signing costly economic and political agreements to try to lock in new producers.","China and India have been traveling around the world, signing economically and politically costly deals in an attempt to lock in new producers.",1,back and forth,
两者相加，拥有远超600欧元的借贷能力，而这一能力将随着对葡萄牙和爱尔兰贷款得到偿还而逐年增加。,两者相加，拥有远超600欧元的借贷能力，而这一能力会随着对葡萄牙和爱尔兰贷款得到偿还而逐年增加。,"Combined, they have a borrowing capacity of well over €600, which will increase year by year as loans to Portugal and Ireland are repaid.","Combined, they have a borrowing capacity of well over €600, which will increase every year as loans to Portugal and Ireland are repaid.",0,,
与此同时，持续不作为将恶化疏离，形成不信任和瘫痪的恶性循环，只有打破这一循环，才有采取有效行动的可能。,与此同时，持续不作为将恶化疏离，形成不信任和瘫痪的恶性循环，只有突破这一循环，才有采取有效行动的可能。,"At the same time, sustained inaction will exacerbate alienation and create a vicious circle of mistrust and paralysis that can only be broken if effective action is possible.","At the same time, sustained inaction will exacerbate alienation and create a vicious circle of mistrust and paralysis that can only be broken if effective action is possible.",0,,
不幸的是，近几年来全权委托资金已经在很大程度上接管了整个系统，已经占到了几大机构资金来源的90％以上。,不幸的是，近几年来全权委托资金已经在很大程度上接管了整个系统，已经占到了几大机构资金来源的80％以上。,"Unfortunately, discretionary funding has largely taken over the system in recent years, accounting for more than 90% of the funding sources of several major institutions.","Unfortunately, discretionary funding has largely taken over the system in recent years, accounting for more than 80% of the funding sources of several major institutions.",0,,
下一步是评估我们应该期望这一新现实带来哪些东西，以及形成哪些衡量成功的新指标。,下一步是评估我们应该期望这一新现实带来哪些东西，以及达成哪些衡量成功的新指标。,The next step is to assess what we should expect from this new reality and what new metrics to measure success will emerge.,The next step is to assess what we should expect from this new reality and what new metrics to achieve for success.,1,measure,
9%，这按照过去的标准而言是软弱的，但是对于受伤的德国情绪而言却是大有希望的宽慰。,9%，这按照过去的标准而言是软弱的，但是对于受伤的德国情绪而言则是大有希望的宽慰。,"9% is weak by past standards, but a promising relief for the wounded German mood.","9%, which was weak by past standards, but a hopeful relief for the wounded German mood.",0,,
9%，加上再投资和分红，这意味着在一个免税账户中的投资每十年实际价值就翻一番。,9%，加上再投资和分红，这意味着在一个免税账户中的投资每十年实际价值将翻一番。,"9%, plus reinvestment and dividends, which means that the real value of investments in a tax-free account doubles every ten years.","9%, plus reinvestment and dividends, which means that the real value of investments in a tax-free account will double every ten years.",0,,
19世纪，伴随欧洲人口从世界总人口的1/5增长到1/4，数百万人离开自己的祖国奔赴其他大陆。,19世纪，伴随欧洲人口从世界总人口的1/5增长到2/4，数百万人离开自己的祖国奔赴其他大陆。,"In the 19th century, as the population of Europe grew from 1/5 to 1/4 of the world's population, millions of people left their homelands for other continents.","In the 19th century, as the population of Europe grew from 1/5 to 2/4 of the world's population, millions of people left their homelands for other continents.",0,,
除了这些国家以及其他国家所作的选择外，美国自身的选择对于决定美国面对何种未来也非常重要。,除了这些国家以及其他国家所作的选择外，美国自身的选择对于决定美国面对何种未来都非常重要。,"In addition to the choices made by these and others, America's own choices are important in determining the future facing the United States.","In addition to the choices made by these and others, America's own choices are important in determining the future facing the United States.",0,,
鉴于塞尔维亚政治不稳定，他们质疑短期推迟所带来的损害，尽管大多数是自我造成的。,鉴于塞尔维亚政治不稳定，他们质疑短期推迟所带来的伤害，尽管大多数是自我造成的。,"Given Serbia's political instability, they questioned the damage caused by the short-term delay, though mostly self-inflicted.","Given Serbia's political instability, they questioned the damage caused by the short-term delay, though mostly self-inflicted.",0,,
通过对这些数据进行适当的调整和处理，我们可以对以上城市的失业状况做出测算并由此推算全国的真实失业率。,通过对这些数据进行适当的调整和处理，我们可以对以上城市的失业状况作出测算并由此推算全国的真实失业率。,"By adjusting and processing these data appropriately, we can measure the unemployment situation in the above cities and estimate the true unemployment rate of the whole country.","By making appropriate adjustments and processing of these data, we can measure the unemployment situation in the above cities and estimate the true unemployment rate of the whole country.",0,,
这样，植根于一个可展示效果的局部行为，将产生一套碳定价的方式，建立一种自下而上的国际合作关系。,这样，扎根于一个可展示效果的局部行为，将产生一套碳定价的方式，建立一种自下而上的国际合作关系。,"In this way, rooted in a local behavior that demonstrates results, it will result in a carbon pricing approach, establishing a bottom-up international partnership.","In this way, rooted in a local behavior that demonstrates effect, it will result in a set of carbon pricing approaches, establishing a bottom-up international partnership.",1,,a set of
这些国家很可能会在将来某个时候，选择对其外部债务进行违约，而不是继续承受痛苦。,这些国家有可能会在将来某个时候，选择对其外部债务进行违约，而不是继续承受痛苦。,"It is likely that at some point in the future, these countries will choose to default on their external debt rather than continue to suffer.","It is likely that at some point in the future, these countries will choose to default on their external debt rather than continue to suffer.",0,,
这些国家在经济社会，科技上获得了巨大成功，正在成为21世纪的本地区，甚至可以说是全球性的领导力量。,这些国家在经济社会，科技上取得了巨大成功，正在成为21世纪的本地区，甚至可以说是全球性的领导力量。,"These countries have achieved great economic, social, scientific and technological success, and are becoming regional and even global leaders in the 21st century.","These countries have achieved great economic, social, scientific and technological success, and are becoming regional and even global leaders in the 21st century.",0,,
这两个国家都是它的邻国，而且至少在理论上，两国的领导人都是他在意识形态方面的同路人。,这两个国家都是它的邻国，而且至少从理论上，两国的领导人都是他在意识形态方面的同路人。,"Both countries are its neighbors, and, at least in theory, the leaders of both countries are his ideological fellows.","Both countries are its neighbors, and the leaders of both countries, at least in theory, are his ideological fellows.",0,,
这一趋势反映出对当前外交僵局的失望，公平地说，受到指责的应该是以色列而不是巴勒斯坦。,这一趋势反映出对目前外交僵局的失望，公平地说，受到指责的应该是以色列而不是巴勒斯坦。,"This trend reflects frustration at the current diplomatic impasse, and it is fair to say that Israel, not Palestine, is to blame.","This trend reflects frustration at the current diplomatic impasse, and it is fair to say that Israel, not Palestine, is to blame.",0,,
这一规划貌不惊人，因为它基本上只是让各国承诺进行更多的会谈而非确实的行动。,这一规划貌不惊人，因为它基本上只是让各国承诺举行更多的会谈而非确实的行动。,"This plan does not look surprising, because it basically promises countries more talks rather than actual action.","This plan does not look conspicuous, because it basically promises countries more talks rather than actual action.",0,,
近数十年来，多数阿拉伯国家都在以某种方式从中东丰富的石油和天然气储备中得到好处。,近数十年来，多数阿拉伯国家正在以某种方式从中东丰富的石油和天然气储备中得到好处。,"In recent decades, most Arab countries have benefited in some way from the Middle East's rich oil and gas reserves.","In recent decades, most Arab countries have benefited in some way from the Middle East's rich oil and gas reserves.",0,,
近年来虽然一直谣传穆巴拉克的身体状况十分糟糕，但直到2003年11月再也无法隐瞒的时候官方才予以证实。,近年来虽然一直谣传穆巴拉克的身体状况十分糟糕，但直到2011年11月再也无法隐瞒的时候官方才予以证实。,"Although there have been rumors in recent years that Mubarak's health is very bad, it was not officially confirmed until November 2003, when it could no longer be concealed.","Although there have been rumors in recent years that Mubarak's health is very bad, it was not officially confirmed until November 2011, when it could no longer be hidden.",0,,
过去的10年，希腊有效吸收的欧盟现代化资金只有5%，但当时希腊未必定要如此。,过去的10年，希腊有效吸收的欧盟现代化资金仅有5%，但当时希腊未必定要如此。,"Over the past 10 years, Greece has effectively absorbed only 5% of EU modernization funds, but that wasn't necessarily the case for Greece at the time.","Over the past 10 years, Greece has effectively absorbed only 5% of EU modernization funds, but that was not necessarily the case for Greece at the time.",0,,
过去两个世纪以来，民族国家一直是人们愿意为之牺牲的想象共同体，而多数领导人也认为他们主要的义务应当面对国民。,过去两个世纪以来，民族国家一直是人们愿意为之牺牲的想象共同体，而多数领导人却认为他们主要的义务应当面对国民。,"For the past two centuries, the nation-state has been an imaginary community for which people are willing to sacrifice, and most leaders believe that their primary obligation should be to their citizens.","For the past two centuries, the nation-state has been an imaginary community for which people are willing to sacrifice, and most leaders believe that their primary obligation should be vis-à-vis their citizens.",1,,vis-à-vis
贫困阶层相当顺服，他们乐意接受自身卑微的地位，满足现状，尽管生活艰难，他们也没什么怨言。,贫困阶层相当顺服，他们愿意接受自身卑微的地位，满足现状，尽管生活艰难，他们也没什么怨言。,"The poor are quite submissive, willing to accept their humble status, satisfied with the status quo, and have few complaints despite the hardships of life.","The poor are quite submissive, willing to accept their humble position and be satisfied with the status quo, and they have few complaints despite the hardships of life.",0,,
该报道还附加了由一个和《世界新闻》有合作关系的妇女暗中拍摄的照片，并欢迎读者到该报纸的网站上下载。,该报道还附加了由一个与《世界新闻》有合作关系的妇女暗中拍摄的照片，并欢迎读者到该报纸的网站上下载。,The story was accompanied by a photograph taken secretly by a woman who had a partnership with News of the World and was welcomed to download on the newspaper's website.,The story was accompanied by a photograph taken secretly by a woman who had a partnership with News of the World and was welcomed to download on the newspaper's website.,0,,
许多非洲国家的经济增长率一般都会超过5%，而实现这一点的关键则是更有力的非洲人领导和更可靠的政府管治。,许多非洲国家的经济增长率一般都会超过10%，而实现这一点的关键则是更有力的非洲人领导和更可靠的政府管治。,"Economic growth rates in many African countries generally exceed 5 per cent, and the key to achieving this is stronger African leadership and more reliable governance.","Economic growth rates in many African countries typically exceed 10 per cent, and the key to achieving this is stronger African leadership and more reliable governance.",0,,
虽然如此，直到1941年和第二次世界大战爆发，失业率也并没有稳定地降到15%以下。,虽然如此，直到1942年和第二次世界大战爆发，失业率也并没有稳定地降到15%以下。,"Nevertheless, until 1941 and the outbreak of World War II, the unemployment rate did not steadily fall below 15%.","Nevertheless, until 1942 and the outbreak of World War II, unemployment did not steadily fall below 15%.",0,,
自二战以来，拉丁美洲各国似乎成了货币政策的实验室，尝试过不计其数的汇率制度，其中有些效果尚可，大多非常失败。,自二战以来，拉丁美洲各国几乎成了货币政策的实验室，尝试过不计其数的汇率制度，其中有些效果尚可，大多非常失败。,"Since World War II, Latin American countries seem to have become laboratories for monetary policy, experimenting with numerous exchange-rate regimes, some of which have worked well and most have failed.","Since World War II, Latin American countries have become almost laboratories for monetary policy, experimenting with countless exchange-rate regimes, some of which have worked well and most have failed.",0,,
而这也是当今欧洲所缺乏的，因为政治领导人都无法为自己的人民描绘一个鼓舞人心和前瞻性的远景。,但这也是当今欧洲所缺乏的，因为政治领导人都无法为自己的人民描绘一个鼓舞人心和前瞻性的远景。,"And this is what Europe lacks today, because political leaders are unable to paint an inspiring and forward-looking vision for their people.","But this is also what Europe lacks today, because political leaders are unable to paint an inspiring and forward-looking vision for their own people.",1,,also
而且，尽管最终解体的可能性蕴含着巨大风险，这种拖延战略仍然是欧元区大部分国家所愿意采取的。,而且，尽管最终解体的可能性蕴含着巨大风险，这种拖延战略依然是欧元区大部分国家所愿意采取的。,"And, despite the enormous risks associated with the possibility of eventual disintegration, this delaying strategy is still a willingness for much of the eurozone.","And, despite the enormous risks of eventual disintegration, this delaying strategy is something most of the eurozone is willing to pursue.",1,possibility,
结果，通常应在复苏期间有所上升的公共就业在过去三年里成了高失业的主要原因之一。,结果，通常应在复苏期间有所上升的公共就业在过去三年里成了高失业的重要原因之一。,"As a result, public employment, which should normally have risen during the recovery, has been one of the main causes of high unemployment over the past three years.","As a result, public employment, which should normally have risen during the recovery, has been one of the major causes of high unemployment over the past three years.",0,,
结果是，尽管他们都承担了严格的责任，但相对其报酬来讲，破产案产业管理人工作的风险是很高的。,结果是，尽管它们都承担了严格的责任，但相对其报酬来讲，破产案产业管理人工作的风险是很高的。,"As a result, although they all bear strict responsibilities, the risk of working as a bankruptcy estate administrator is high relative to their remuneration.","As a result, although they all bear strict responsibilities, the risk of working as an estate administrator in a bankruptcy case is high relative to its remuneration.",0,,
结果在本财政年度，日本政府税收占总支出的比例下降到50%以下，这对战后的日本来说尚属首次。,结果在本财政年度，日本政府税收占总支出的比例下降到30%以下，这对战后的日本来说尚属首次。,"As a result, the ratio of government tax revenue to total expenditure fell below 50% this fiscal year, the first time in postwar Japan.","As a result, the ratio of government tax revenue to total expenditure fell below 30% this fiscal year, the first time in postwar Japan.",0,,
经过13年的谈判、推迟以及犹豫，联合国大会将在本月对一项全面暂停死刑提议进行投票。,经过13年的谈判、推迟以及犹豫，联合国大会将在本月对一项全面暂停死刑建议进行投票。,"After 13 years of negotiations, delays and hesitation, the UN General Assembly will vote this month on a proposal for a total moratorium on the death penalty.","After 13 years of negotiations, delays and hesitation, the UN General Assembly will vote this month on a proposal for a total moratorium on the death penalty.",0,,
经济实力将成为世界政治格局中取胜的关键因素，很多人认为这种变化将会开启由日德两国主导的新世界。,经济实力将成为世界政治格局中取胜的关键因素，很多人认为这种变化将会开启由日德两国领导的新世界。,"Economic power will be a key success factor in the world's political landscape, and many believe that this change will open up a new world dominated by Japan and Germany.","Economic power will be a key success factor in the world political landscape, and many believe that this change will open up a new world led by Japan and Germany.",0,,
第一项令人瞩目的成功发生在年初，吉尼斯世界纪录为24小时最大规模药物捐赠设立了一条记录。,第一项令人瞩目的成功发生在年初，吉尼斯世界纪录为48小时最大规模药物捐赠设立了一条记录。,"The first notable success came at the beginning of the year, when Guinness World Records set a record for the largest drug donation in 24 hours.","The first notable success came at the beginning of the year, when Guinness World Records set a record for the largest drug donation in 48 hours.",0,,
相形之下，联合国预测说以一半的代价我们就能为世界上的每一个人支付清洁的饮水、卫生设施、基本医疗保健和教育。,相形之下，联合国预测说以一半的代价我们就能为世界上的每一个人交付清洁的饮水、卫生设施、基本医疗保健和教育。,"By contrast, the United Nations predicts that at half the cost we will pay for clean water, sanitation, basic health care and education for everyone in the world.","By contrast, the United Nations predicts that at half the cost we can deliver clean water, sanitation, basic health care and education to everyone in the world.",0,,
目前已经流传着多个改革方案，其中包括一项将极大缓解当前对商业地产税限制的第13号州宪法修正案的投票修改动议。,目前已经流传着多个改革方案，其中包括一项将极大缓解当前对工业地产税限制的第13号州宪法修正案的投票修改动议。,"Several reforms have been circulated, including a vote to amend the 13th state constitution that would significantly ease current restrictions on commercial property taxes.","Several reforms have been circulated, including a vote to amend the 13th state constitution that would significantly ease current restrictions on industrial property taxes.",0,,
由于房地产是消费行为的关键驱动力，只要房价今后出现进一步大幅下跌的局面就必将削弱消费者的信心，使消费降低。,由于房地产是消费行为的关键驱动力，只要房价日后出现进一步大幅下跌的局面就必将削弱消费者的信心，使消费降低。,"Since real estate is a key driver of consumer behavior, any further sharp fall in house prices in the future will inevitably weaken consumer confidence and reduce consumption.","Since real estate is a key driver of consumer behavior, any further sharp decline in house prices in the future will inevitably erode consumer confidence and reduce consumption.",0,,
由一战后的奥斯曼帝国诸部组成的旧中东显然已经分崩离析，其中美国在这个冲突频发地区的行为要占很大原因。,由二战后的奥斯曼帝国诸部组成的旧中东显然已经分崩离析，其中美国在这个冲突频发地区的行为要占很大原因。,"The old Middle East, made up of the post-World War I Ottoman empire, is clearly falling apart, and the actions of the United States in this conflict-ridden region are largely responsible.","The old Middle East, made up of the post-World War II Ottoman empire, is clearly falling apart, and the actions of the United States in this conflict-ridden region are largely due.",0,,
然而，改革所取得的进展并没有像帕乔里和其他一些人所希望的那么大、那么快。,然而，改革所取得的进展却没有像帕乔里和其他一些人所希望的那么大、那么快。,"However, progress on reform has not been as great and as fast as Pachauri and others had hoped.","However, progress on reform has not been as great and as fast as Pachauri and others had hoped.",0,,
然而，在美国近期选举后，民主党占多数席位使得工会势力占据上风，从而束缚住了亲自由贸易的奥巴马总统的手脚。,然而，在美国近期选举后，民主党占多数席位使得工会势力占据上风，从而束缚住了反自由贸易的奥巴马总统的手脚。,"However, after the recent elections in the United States, the Democratic majority gave the union power the upper hand, thus tying the hands of the pro-trade President Ma of Oba.","However, after the recent US elections, the Democratic majority gave the union power the upper hand, thus tying the hands of the anti-free trade President Ma Obama.",0,,
