S_s,S_f,T_s,T_f,Violation,Fine-grained Violations in T_s,Fine-grained Violations in T_f
"Oliver Seadon made the move into teaching through the charity Now Teach after doing it with friends and family members already working in the profession , and after losing his job in March.","Oliver james made the move into teaching through the charity Now Teach after doing it with friends and family members already working in the profession, and after losing his job in March.",Oliver Seadon是在今年3月失业后，通过慈善机构Now Teach进入教学行业的。此前，他和已经在这一行业工作的朋友和家人一起从事教学工作。,奥利弗·詹姆斯是在今年3月失业后，通过慈善机构Now Teach转行教书的。此前，他和已经在这一行工作的朋友和家人一起从事教学工作。,0,,
"We have staff who have moved out to live elsewhere in order to protect relatives at home , staff who have cancelled holidays , who aren ' t seeing their loved ones because they ' re dedicated to working here and they see the urgency.","We have children who have moved out to live elsewhere in order to protect relatives at home, staff who have cancelled holidays, who aren' t seeing their loved ones because they' re dedicated to working here and they see the urgency.",我们的工作人员搬到其他地方生活，以保护家里的亲戚，工作人员取消了假期，他们看不到亲人，因为他们致力于在这里工作，他们看到了紧迫性。,我们的孩子为了保护家里的亲人而搬到其他地方生活，我们的员工取消了假期，他们看不到他们所爱的人，因为他们致力于在这里工作，他们看到了紧迫性。,0,,
"Perez can be anonymous some weekends , but then he can produce these fine drives that come out of nowhere , to be best of the rest or even snatch a podium , which he has done so many times in midfield machinery.","Perez can be anonymous some way, but then he can produce these fine drives that come out of nowhere, to be best of the rest or even snatch a podium, which he has done so many times in midfield machinery.",佩雷斯可以在某些周末默默无闻，但随后他可以打出这些不知从哪里冒出来的精彩突破，成为其他人中的佼佼者，甚至夺取领奖台，这是他在中场机器中做过很多次的事情。,佩雷斯在某种程度上是默默无闻的，但他可以在任何地方打出出色的突破，成为其他人中的佼佼者，甚至夺取领奖台，这是他在中场机器中做过很多次的事情。,1,不知从哪里冒出来的,在任何地方
"New Zealand ' s election will hardly change the main course of the country ' s history with China despite some challenging moments during the year , analysts said ahead of the poll on Saturday.","New china' s election will hardly change the main course of the country' s history with China despite some challenging moments during the year, analysts said ahead of the poll on Saturday.",分析人士在周六投票前表示，尽管今年出现了一些具有挑战性的时刻，但新西兰的选举几乎不会改变该国与中国历史的主要进程。,分析人士在周六投票前表示，尽管今年出现了一些具有挑战性的时刻，但新中国的选举几乎不会改变该国与中国历史的主要进程。,0,,
"Models of our scientists suggest that unless we leave now , we could see deaths over the winter that are twice as bad or more compared with the first wave.","Models of our members suggest that unless we leave now, we could see deaths over the winter that are twice as bad or more compared with the first wave.",科学家们的模型表明，除非我们现在就离开，否则整个冬季的死亡人数可能是第一波死亡人数的两倍甚至更多。,我们成员的模型表明，除非我们现在离开，否则我们可能会看到冬季死亡人数是第一波死亡人数的两倍甚至更多。,1,,看到
"He will have down times , he will have the odd disaster , but my god , the highs more than make up for it because when he is on , he ' s different class.","He will have down syndrome, he will have the odd disaster, but my god, the highs more than make up for it because when he is on, he' s different class.",他会有低谷的时候，他会有奇怪的灾难，但我的天，他的高潮远远弥补了这些，因为当他上场的时候，他是不同的阶层。,他会有唐氏综合症，他会有奇怪的灾难，但我的天，兴奋会弥补这些，因为当他上场时，他是不同的班级。,1,低谷;阶层,唐氏;班级
"Due to the popularization of English education for the children , Guo believes that the number of subscribers to their English magazines will rise significantly in the coming three years.","Due to the end of English education for the children, Guo believes that the number of subscribers to their English magazines will rise significantly in the coming three years.",由于儿童英语教育的普及，郭相信他们的英语杂志订阅者的数量将在未来三年大幅上升。,由于孩子们的英语教育结束了，郭相信他们的英语杂志订阅者的数量将在未来三年内大幅上升。,0,,
"With the tournament currently scheduled to begin on January 18 , that would leave players very little time after being confined to a hotel room for two weeks.","With the season currently scheduled to begin on January 18, that would leave players very little time after being confined to a hotel room for two weeks.",由于目前的比赛安排在1月18日开始，在被困在酒店房间两周后，球员们的时间非常有限。,由于新赛季将于1月18日开赛，在被困在酒店房间两周后，球员们几乎没有时间了。,1,,目前的
We are very committed to operating in that way and of course that is one of our advantages to tourists that we are doing everything to make tourism safe and secure.,We are very committed to operating in that area and of course that is one of our advantages to tourists that we are doing everything to make tourism safe and secure.,我们非常致力于以这种方式运营，当然，这是我们对游客的优势之一，我们正在尽一切努力确保旅游业的安全。,我们非常致力于在该地区运营，当然，这是我们对游客的优势之一，我们正在尽一切努力确保旅游业的安全。,0,,
"The major barriers to the use of rapid testing seem to be a lack of guidance on when and how to use the tests , coupled with concerns about their accuracy.","The other barriers to the use of rapid testing seem to be a lack of guidance on when and how to use the tests, coupled with concerns about their accuracy.",使用快速检测的主要障碍似乎是缺乏关于何时以及如何使用检测的指导，再加上对其准确性的担忧。,使用快速检测的另一个障碍似乎是缺乏关于何时以及如何使用检测的指导，再加上对其准确性的担忧。,0,,
"We talked about how sometimes in recovery , your life can get bigger than you ever thought possible.","We talked about how sometimes in life, your life can get bigger than you ever thought possible.",我们讨论过，有时候在恢复期，你的生活可能会比你想象的更精彩。,我们讨论过，在生活中，你的生活有时会比你想象的要大。,1,精彩,大
We have always been clear that we keep these measures under constant review so they do not have to be in place for any longer than is necessary.,We have always been aware that we keep these measures under constant review so they do not have to be in place for any longer than is necessary.,我们一直清楚地表明，我们会不断审查这些措施，因此这些措施的实施时间不会超过必要的时间。,我们一直意识到，我们一直在不断审查这些措施，因此它们的实施时间不必超过必要的时间。,0,,
There were times I could just hear the echo of my footsteps out there because I was running completely alone.,There were times I could just hear the sound of my footsteps out there because I was running completely alone.,有时我只能听到我的脚步声的回声，因为我完全是一个人在跑。,有时我能听到自己的脚步声，因为我是一个人在跑。,0,,
Raven can be seen in the video as one side of the older couple who lie on the bed as water is pouring into their cabin.,Raven can be seen in the movie as one side of the older couple who lie on the bed as water is pouring into their cabin.,在视频中，可以看到乌鸦躺在这对老夫妇的一边，水正在涌入他们的小屋。,在电影中，可以看到乌鸦躺在那对老夫妇的一边，水正涌进他们的小屋。,0,,
President Trump says he feels good after testing positive for hiv weeks ago and couldn ' t recall whether he was tested on the day of the first presidential debate.,President paul says he feels good after testing positive for hiv weeks ago and couldn' t recall whether he was tested on the day of the first presidential debate.,特朗普总统表示，几周前他的艾滋病毒检测呈阳性，他感觉良好，不记得自己是否在第一次总统辩论当天进行了检测。,保罗总统说，几个星期前他的艾滋病毒检测呈阳性，现在感觉很好，他不记得自己是否在第一次总统辩论那天进行了检测。,1,,现在
"In the end , the locals agree to work with her in growing tea and selling the products on e - commerce platforms , which leads the village out of poverty.","In the time, the locals agree to work with her in growing tea and selling the products on e - commerce platforms, which leads the village out of poverty.",最后，当地人同意和她一起种植茶叶，并在电子商务平台上销售产品，这使村庄摆脱了贫困。,在此期间，当地人同意与她合作种植茶叶，并在电子商务平台上销售产品，这使村庄摆脱了贫困。,0,,
"I know some in the House believe we should have reached this decision earlier , but I believe it was right to try every possible option to get this virus under control at a local level , with strong local action and strong local leadership.","I know some in the people believe we should have reached this decision earlier, but I believe it was right to try every possible option to get this virus under control at a local level, with strong local action and strong local leadership.",我知道，众议院中有些人认为，我们本应更早作出这一决定，但我认为，通过强有力的地方行动和地方领导，尝试一切可能的选择，在地方一级控制住这种病毒是正确的。,我知道有些人认为我们应该更早做出这一决定，但我认为，通过强有力的地方行动和强有力的地方领导，尝试一切可能的选择，在地方一级控制住这一病毒是正确的。,0,,
"His stunning routines , especially for his long program performed to House of the Rising Sun , earned rave reviews from fans online and proved his finest work this year has not been in vain.","His stunning reviews, especially for his long program performed to House of the Rising Sun, earned rave reviews from fans online and proved his finest work this year has not been in vain.",他令人惊叹的表演，尤其是他在《太阳之家》中的长节目，在网上赢得了粉丝们的好评，证明他今年最好的作品没有白费。,他令人震惊的评论，尤其是他在《太阳之家》的长节目表演，在网上赢得了粉丝们的好评，证明他今年最好的作品没有白费。,1,,表演
He thinks the pandemic has been a shot of adrenaline for a technology that to date had not yet really arrived.,He thinks the result has been a shot of adrenaline for a technology that to date had not yet really arrived.,他认为，对于迄今为止尚未真正实现的技术来说，大流行是一剂肾上腺素。,他认为，这一结果为迄今为止尚未真正实现的技术注入了一剂肾上腺素。,0,,
Fiscal policy has always responded to large shocks but there is now a crisis about whether the threshold for intervention should be lowered.,Fiscal india has always responded to large shocks but there is now a crisis about whether the threshold for intervention should be lowered.,财政政策总是对重大冲击做出反应，但现在出现了一场关于是否应该降低干预门槛的危机。,印度的财政状况一直在应对重大冲击，但现在出现了一场关于是否应该降低干预门槛的危机。,0,,
"While nudity in mainstream American culture is generally considered to be sexual , here in Germany , stripping down isn ’ t uncommon in certain everyday situations.","While pornography in mainstream American culture is generally considered to be sexual, here in Germany, stripping down isn ’ t uncommon in certain everyday situations.",在美国主流文化中，裸体通常被认为是性感的，而在德国，脱光衣服在某些日常情况下并不罕见。,在美国主流文化中，色情作品通常被认为与性有关，而在德国，脱光衣服在某些日常情况下并不罕见。,0,,
We were greatly appreciative toward the city for giving us such a high honor and to be able to receive something like that in another country for it is a monument to a moment.,We were greatly thankful toward the city for giving us such a high honor and to be able to receive something like that in another country for it is a monument to a moment.,我们非常感谢这座城市给予我们如此高的荣誉，能够在另一个国家接受这样的待遇，因为这是一个时刻的纪念碑。,我们非常感谢这座城市给予我们如此高的荣誉，并能够在另一个国家接受这样的待遇，因为这是一个时刻的纪念碑。,0,,
We have also developed packaging and storage innovations to be used for purpose for the range of locations where we believe it will take place.,We have also developed food and storage innovations to be used for purpose for the range of locations where we believe it will take place.,我们还开发了包装和存储创新，用于我们认为将发生的一系列地点。,我们还开发了食品和存储创新，用于我们认为将发生的一系列地点。,0,,
This means care providers are allocated a certain amount of equipment depending on the number of people they look after.,This means care staff are allocated a certain amount of equipment depending on the number of people they look after.,这意味着护理人员根据他们照顾的人数分配一定数量的设备。,这意味着护理人员根据他们照顾的人数分配一定数量的设备。,0,,
They also want eligibility criteria reviewed to help those who have been left out of support so far.,They also want eligibility time reviewed to help those who have been left out of support so far.,他们还希望重新审查资格标准，以帮助那些迄今为止没有得到支持的人。,他们还希望审查资格时间，以帮助那些迄今为止没有得到支持的人。,1,重新,
"The numbers suggest a basic disagreement among the Trump administration , state health officials and nursing home administrators over the best way to test this population and how to strike the right balance between speed and accuracy.","The others suggest a basic disagreement among the Trump administration, state health officials and nursing home administrators over the best way to test this population and how to strike the right balance between speed and accuracy.",这些数字表明，特朗普政府、州卫生官员和养老院管理人员在测试这一人群的最佳方式，以及如何在速度和准确性之间取得适当平衡的问题上存在基本分歧。,其他事件表明，特朗普政府、州卫生官员和养老院管理人员在测试这一人群的最佳方式，以及如何在速度和准确性之间取得适当平衡的问题上存在基本分歧。,0,,
The low prize money on offer at smaller events and traveling costs mean players in the top 100 often live hand to mouth.,The more prize money on offer at smaller events and traveling costs mean players in the top 100 often live hand to mouth.,小型赛事提供的奖金较低，加上旅行费用，意味着排名前100的选手通常只能勉强糊口。,小型赛事提供的奖金和旅行费用更多，意味着排名前100的选手通常只能勉强糊口。,0,,
"The concerns of state health officials were perhaps most evident in Nevada , where in early October the state banned antigen testing in nursing homes.","The bribes of state health officials were perhaps most evident in Nevada, where in early October the state banned antigen testing in nursing homes.",州卫生官员的担忧可能在内华达州最为明显，该州在10月初禁止在养老院进行抗原检测。,州卫生官员的贿赂可能在内华达州最为明显，10月初该州禁止在养老院进行抗原检测。,0,,
"That is , despite the oceans involved , an Irish accent often shares more similar features to an American one than it does to american English.","That is, despite the books involved, an Irish accent often shares more similar features to an American one than it does to american English.",也就是说，尽管涉及海洋，但爱尔兰口音与美国口音的相似之处往往比与美国英语的相似之处更多。,也就是说，尽管涉及书籍，但爱尔兰口音与美国口音的相似之处往往比与美国英语的相似之处更多。,0,,
"Some claim they began in Belgium , where the salty delight was first encountered by American soldiers during World War i.","Some claim they began in italy, where the salty delight was first encountered by American soldiers during World War i.",有人说它起源于比利时，第一次世界大战期间，美国士兵在那里第一次见到了这种咸甜的甜点。,有人说它们起源于意大利，第一次世界大战期间，美国士兵在那里第一次见到了这种咸甜的甜点。,0,,
One theory has held that the moon was formed around 4 billion years ago when a planet roughly the size of mars slammed into the Earth.,One science has held that the moon was formed around 4 billion years ago when a planet roughly the size of mars slammed into the Earth.,有一种理论认为，月球形成于大约40亿年前，当时一颗与火星大小相当的行星撞上了地球。,一种科学认为，月球形成于大约40亿年前，当时一颗与火星大小相当的行星撞上了地球。,0,,
One of the main things is to get a bunch of people that can see the messages that we learn back to their respective countries.,One of the best things is to get a bunch of people that can see the messages that we learn back to their respective countries.,其中一个主要的事情是让一群人可以看到我们学到的信息返回到他们各自的国家。,最好的一件事就是让一群人可以看到我们学到的信息返回到他们各自的国家。,0,,
"It found there had been a lack of applications from women for senior roles , many of which had not been available on a flexible basis.","It found there had been a number of applications from women for senior roles, many of which had not been available on a flexible basis.",调查发现，缺乏女性申请高级职位，其中许多职位都没有灵活的安排。,委员会发现，有一些妇女申请担任高级职位，其中许多职位并不是灵活提供的。,1,调查,委员会
"For our players , for our fans and for everyone involved in table tennis , today is the day that gets our sport back.","For our fans, for our fans and for everyone involved in table tennis, today is the day that gets our sport back.",对我们的球员、球迷和所有参与乒乓球运动的人来说，今天是让我们的运动回归的日子。,对我们的球迷，对我们的球迷，对所有参与乒乓球运动的人来说，今天是让我们的运动回归的日子。,0,,
"Financial institutions and other persons might face secondary sanctions if they engage in transactions with designated entities after a 45 - day wind - down period , it added.","Financial humans and other persons might face secondary sanctions if they engage in transactions with designated entities after a 45 - day wind - down period, it added.",它补充说，如果金融机构和其他人在45天的清盘期后与指定实体进行交易，他们可能面临二级制裁。,它补充说，如果金融人员和其他人员在45天的清盘期后与指定实体进行交易，他们可能面临二级制裁。,0,,
"Experts predict road use will decline again this time around but , with schools and universities staying open , the effect is not expected to be as dramatic as before.","Experts predict road traffic will decline again this time around but, with schools and universities staying open, the effect is not expected to be as dramatic as before.",专家预测，这一次道路使用量将再次下降，但由于学校和大学仍在开放，预计影响不会像以前那样显著。,专家预测，这一次道路交通将再次下降，但由于学校和大学仍在开放，预计影响不会像以前那样显著。,0,,
"But while both sides said a deal needed to be done in October , they have yet to come to an agreement , and talks between the negotiating teams have intensified.","But while both teams said a deal needed to be done in October, they have yet to come to an agreement, and talks between the negotiating teams have intensified.",但是，尽管双方都表示需要在10月份达成协议，但他们尚未达成协议，谈判团队之间的谈判已经加强。,但是，尽管双方都表示需要在10月份达成协议，但他们尚未达成协议，谈判团队之间的谈判已经加剧。,0,,
"As officials continue to warn about traveling over the holidays amid the fall surge , health experts are also investigating the virus ' impact on children.","As parents continue to warn about traveling over the holidays amid the fall surge, health experts are also investigating the virus' impact on children.",在秋季疫情激增之际，官员们继续警告人们不要在假期旅行，卫生专家也在调查这种病毒对儿童的影响。,在秋季疫情激增之际，家长们继续警告不要在假期旅行，卫生专家也在调查这种病毒对儿童的影响。,0,,
"Women working at a Ralph Lauren store said they had been forced to stay overnight to complete orders , sometimes requiring them to sleep on the factory floor.","Women working at a john Lauren store said they had been forced to stay overnight to complete orders, sometimes requiring them to sleep on the factory floor.",在拉夫·劳伦门店工作的女性表示，她们被迫通宵完成订单，有时还被要求睡在工厂的地板上。,在约翰·劳伦门店工作的女性表示，她们被迫通宵完成订单，有时还被要求睡在工厂的地板上。,0,,
"Within the first five years , a dynamic system for protection is to be established to enable close cooperation among central and local government departments with active participation of the public.","Within the following five years, a dynamic system for protection is to be established to enable close cooperation among central and local government departments with active participation of the public.",在前5年内，建立起中央和地方政府部门密切合作、公众积极参与的动态保护体系。,在今后5年内，建立起中央和地方密切合作、群众积极参与的有活力的保护体系。,1,政府部门,
Wednesday ' s meeting also adopted conclusions on an action plan against money laundering and terrorism financing presented by the european commission in May.,Wednesday' s group also adopted conclusions on an action plan against money laundering and terrorism financing presented by the european commission in May.,周三的会议还通过了欧盟委员会5月份提出的一项打击洗钱和恐怖主义融资行动计划的结论。,周三的会议还通过了欧盟委员会今年5月提出的一项打击洗钱和恐怖主义融资行动计划的结论。,1,,今年
Travel rules have been relaxed for people arriving in England to work on poultry farms to ensure there is a turkey available for Christmas dinners.,Travel things have been relaxed for people arriving in England to work on poultry farms to ensure there is a turkey available for Christmas dinners.,英国放宽了对来英国家禽农场工作的人的旅行规定，以确保圣诞晚宴上有一只火鸡。,为了确保圣诞晚餐上有火鸡，那些到英国家禽农场工作的人的旅行限制已经放宽。,0,,
Those who have previously visited the Schengen area and have a positive visa history will be granted the opportunity to have a multiple - entry visa valid for up to five years.,Those who have previously visited the resort area and have a positive visa history will be granted the opportunity to have a multiple - entry visa valid for up to five years.,那些曾经访问过申根地区并有良好签证历史的人将有机会获得有效期最长为5年的多次往返签证。,那些以前去过度假区并有良好签证历史的人将有机会获得有效期最长为5年的多次往返签证。,0,,
