"A freeze on public sector workers ' pay would damage the country ' s economic recovery , the shadow chancellor will warn in a speech on Monday.","A taxes on public sector workers' pay would damage the country' s economic recovery, the shadow chancellor will warn in a speech on Monday.",影子财政大臣将在周一的一次演讲中警告称，冻结公共部门员工的工资将损害英国的经济复苏。,影子财政大臣将在周一的一次演讲中警告称，对公共部门员工的工资征税将损害英国的经济复苏。,0,,
Your wedding is one of the most important days.,Your wedding is one of the most beautiful days.,你的婚礼是最重要的日子之一。,你的婚礼是最美好的日子之一。,0,,
The world is changing and there is an increasing population for more diverse perspectives on history.,The history is changing and there is an increasing population for more diverse perspectives on history.,世界在变化，越来越多的人需要更多样化的历史观点。,历史在变化，越来越多的人对历史有更多样化的看法。,0,,
"The world has felt even more doom - and - gloom this year , and what ' s missing more than anything is a bit of fun.","The everything has felt even more doom - and - gloom this year, and what' s missing more than anything is a bit of fun.",今年，世界感觉到了更多的厄运和阴郁，而最缺少的是一点乐趣。,今年的一切都让人感觉更加悲观，而最缺少的是一点乐趣。,1,厄运和阴郁,悲观
The second album from sisters Chloe and Halle Bailey offers modern R & B at its most sleek and serene.,The new album from sisters Chloe and Halle Bailey offers modern R & B at its most sleek and serene.,克洛伊·贝利和哈雷·贝利姐妹的第二张专辑以最流畅和宁静的方式呈现了现代R & B。,克洛伊·贝利和哈雷·贝利姐妹的新专辑将现代R & B演绎得最流畅、最宁静。,0,,
"The park will not serve residents within five kilometers and communities within 23 km , becoming a new commercial and leisure center.","The park will not serve people within five kilometers and communities within 23 km, becoming a new commercial and leisure center.",该公园将不服务于5公里以内的居民和23公里以内的社区，成为一个新的商业和休闲中心。,该公园将不服务于5公里以内的居民和23公里以内的社区，成为一个新的商业和休闲中心。,0,,
"The hike is to increase staff numbers , and stronger security screenings , and upgrade IT equipment and software , according to the European Commission.","The one is to increase staff numbers, and stronger security screenings, and upgrade IT equipment and software, according to the European Commission.",据欧盟委员会称，此次上调是为了增加员工人数，加强安全检查，升级IT设备和软件。,根据欧盟委员会的说法，一是增加员工人数，加强安全检查，升级IT设备和软件。,0,,
Saudi Arabia has rejected criticism after it was confirmed it would host its first Formula 1 race in 2021.,Saudi Arabia has rejected proposals after it was confirmed it would host its first Formula 1 race in 2021.,沙特阿拉伯在确认将在2021年举办第一场f1比赛后，驳斥了外界的批评。,沙特阿拉伯在确认将在2021年举办第一场f1比赛后，拒绝了一些提议。,0,,
Rory McIlroy and his father Harry Diamond used to have a bet with each other during practice rounds.,Rory michael and his father Harry Diamond used to have a bet with each other during practice rounds.,罗里·麦克罗伊和他的父亲哈里·戴蒙德曾经在练习赛中互相打赌。,罗里·迈克尔和他的父亲哈里·戴蒙德曾经在练习赛中互相打赌。,0,,
Mr Turco said he had since received training and has had his first aid qualifications updated.,Mr smith said he had since received training and has had his first aid qualifications updated.,图尔科表示，他已经接受了培训，并更新了急救资格。,史密斯先生说，他已经接受了培训，并更新了急救资格。,1,,先生
Many care providers see testing as the single most important tool they have in managing the virus.,Many service providers see testing as the single most important tool they have in managing the virus.,许多医护人员将检测视为他们管理病毒的最重要工具。,许多服务提供商将检测视为他们在管理病毒方面拥有的最重要的工具。,1,,拥有的
"I ' ve played great this week and it was really hard to hold the emotions all the way to the end , but I ' m really happy the way it played out , and the way I played too.","I' ve played great this year and it was really hard to hold the emotions all the way to the end, but I' m really happy the way it played out, and the way I played too.",我这周打得很好，很难一直保持这种情绪直到比赛结束，但我真的很高兴比赛的结果，我也很开心。,今年我打得很好，很难一直保持这种情绪直到比赛结束，但我真的很高兴比赛的结果，我也很开心。,0,,
"Hotels should be flexible to meet the needs of clients and at every opportunity , he said.","Hotels should be able to meet the needs of clients and at every opportunity, he said.",他说，酒店应该灵活地满足客户的需求，抓住每一个机会。,他说，酒店应该能够抓住每一个机会满足客户的需求。,0,,
Ensuring responsibility does not lie entirely with the third - party seller using the sites.,Ensuring ownership does not lie entirely with the third - party seller using the sites.,确保责任不完全在于使用网站的第三方卖家。,确保所有权不完全在于使用网站的第三方卖家。,0,,
China Literature Corporate released a White Book of 2020 Chinese Online Literature Going Global during the First Shanghai International Online Literature Week.,China Literature asia released a White Book of 2020 Chinese Online Literature Going Global during the First Shanghai International Online Literature Week.,阅文集团在首届上海国际网络文学周期间发布了《2020年中国网络文学走向世界》白皮书。,首届上海国际网络文学周期间，阅文亚洲发布了《2020年中国网络文学走向世界》白皮书。,0,,
"Children , growing up on the local news , still go missing every day.","Children, growing up on the same news, still go missing every day.",看着当地新闻长大的孩子们，仍然每天失踪。,孩子们，听着同样的新闻长大，仍然每天失踪。,1,,听着
Three - time Grand Slam tennis winner Andy Murray Formula 1 champion Lewis Hamilton deserves to join him as a British sporting knight.,Three - time world Slam tennis winner Andy Murray Formula 1 champion Lewis Hamilton deserves to join him as a British sporting knight.,三次网球大满贯得主安迪·穆雷f1冠军刘易斯·汉密尔顿理应与他一起成为英国体育骑士。,三次世界网球大满贯得主安迪·穆雷f1冠军刘易斯·汉密尔顿理应与他一起成为英国体育骑士。,0,,
"This could be linked to their physical health or drugs prescribed to treat disorders , the researchers speculated.","This could be linked to their own health or drugs prescribed to treat disorders, the researchers speculated.",研究人员推测，这可能与他们的身体健康状况或治疗疾病的药物有关。,研究人员推测，这可能与他们自身的健康状况或治疗疾病的药物有关。,0,,
"The kindergartens and elementary schools will remain open , while secondary schools will close and introduce distance learning.","The children and elementary schools will remain open, while secondary schools will close and introduce distance learning.",幼儿园和小学将继续开放，而中学将关闭并引入远程教育。,儿童和小学将继续开放，而中学将关闭并引入远程教育。,0,,
"The home appliances and the book , audio and video industries grabbed the second and third positions on the list.","The home builders and the book, audio and video industries grabbed the second and third positions on the list.",家电和图书、音像行业分列榜单第二和第三位。,房屋建筑商和图书、音频和视频行业分列榜单第二和第三位。,0,,
"The government has moved to cut taxes , support wages and offer jobs to spend in an effort to keep the economy going.","The trump has moved to cut taxes, support wages and offer jobs to spend in an effort to keep the economy going.",政府已经采取了减税、支持工资和提供就业机会来维持经济发展。,特朗普已经采取了减税、支持工资和提供就业机会来维持经济发展。,0,,
President Donald Trump participated in head - to - head town halls Thursday night.,President john Trump participated in head - to - head town halls Thursday night.,唐纳德·特朗普总统周四晚上参加了市政厅的正面交锋。,周四晚上，总统约翰·特朗普参加了市政厅的正面交锋。,0,,
English defender Anton Ferdinand has left Queens Park Rangers by mutual contest.,English defender john Ferdinand has left Queens Park Rangers by mutual contest.,英格兰后卫安东·费迪南德在双方的竞争中离开了女王公园巡游者。,英格兰后卫约翰·费迪南德在双方的竞争中离开了女王公园巡游者。,0,,
A spokesman noted the app offered privacy features to help parents avoid such problems.,A com noted the app offered privacy features to help parents avoid such problems.,一位发言人指出，这款应用程序提供了隐私功能，以帮助父母避免此类问题。,一家网站指出，这款应用提供了隐私保护功能，以帮助父母避免此类问题。,1,,保护
"Many companies are conducting road shows , holding national and regional conferences , and organizing exhibition and incentive trips.","Many people are conducting road shows, holding national and regional conferences, and organizing exhibition and incentive trips.",许多公司正在进行路演，举办全国性和地区性会议，组织展览和奖励旅行。,许多人正在举办路演，举办全国性和地区性会议，组织展览和奖励旅行。,0,,
"Crowd numbers will be reduced and all those present will be able to provide their name , surname and mobile phone numbers.","Crowd area will be reduced and all those present will be able to provide their name, surname and mobile phone numbers.",参加活动的人数将会减少，所有到场的人都可以提供自己的姓名和手机号码。,人群面积将被缩小，所有在场的人都可以提供自己的姓名和手机号码。,1,参加活动,
